23219{{}}370735{{}}Academy Raider{{}}Magic 2014 Core Set{{}}M14{{}}Creature — Human Warrior{{}}1{{}}1{{}}{{}}{2}{R}{{}}3{{}}Karl Kopinski{{}}{{}}R{{}}{{}}124{{}}C{{}}2.05{{}}|||7/1/2013 : The triggered ability triggers just once each time Academy Raider deals combat damage to a player, regardless of how much damage it deals.{{}}{{}}Intimidate <em>(This creature can't be blocked except by artifact creatures and/or creatures that share a color with it.)</em>|||Whenever Academy Raider deals combat damage to a player, you may discard a card. If you do, draw a card.{{}}124{{}}TRUE
23220{{}}370581{{}}Accorder's Shield{{}}Magic 2014 Core Set{{}}M14{{}}Artifact — Equipment{{}}{{}}{{}}{{}}{0}{{}}0{{}}Alan Pollack{{}}<em>An Auriok shield is polished to a mirror finish even on the inside, enabling its bearer to watch foes ahead and behind.</em>{{}}A{{}}{{}}204{{}}U{{}}3.354{{}}{{}}{{}}Equipped creature gets +0/+3 and has vigilance. <em>(Attacking doesn't cause it to tap.)</em>|||Equip {3} <em>({3}: Attach to target creature you control. Equip only as a sorcery.)</em>{{}}204{{}}TRUE
23221{{}}370811{{}}Accursed Spirit{{}}Magic 2014 Core Set{{}}M14{{}}Creature — Spirit{{}}3{{}}2{{}}{{}}{3}{B}{{}}4{{}}Kev Walker{{}}<em>Many have heard the slither of dragging armor and the soft squelch of its voice. But only its victims ever meet its icy gaze.</em>{{}}B{{}}{{}}83{{}}C{{}}2.967{{}}{{}}{{}}Intimidate <em>(This creature can't be blocked except by artifact creatures and/or creatures that share a color with it.)</em>{{}}83{{}}TRUE
23222{{}}370618{{}}Act of Treason{{}}Magic 2014 Core Set{{}}M14{{}}Sorcery{{}}{{}}{{}}{{}}{2}{R}{{}}3{{}}Eric Deschamps{{}}"<em>""Rage courses in every heart, yearning to betray its rational prison.""—Sarkhan Vol</em>"{{}}R{{}}{{}}125{{}}C{{}}3.667{{}}|||10/1/2009 : Act of Treason can target any creature, even one that's untapped or one you already control. |||8/15/2010 : Gaining control of a creature doesn't cause you to gain control of any Auras or Equipment attached to it. |||7/1/2013 : If you control a legendary creature and gain control of another legendary creature with the same name, you’ll choose one to remain on the battlefield and put the other into its owner’s graveyard.{{}}{{}}Gain control of target creature until end of turn. Untap that creature. It gains haste until end of turn. <em>(It can attack and {T} this turn.)</em>{{}}125{{}}TRUE
23223{{}}370738{{}}Advocate of the Beast{{}}Magic 2014 Core Set{{}}M14{{}}Creature — Elf Shaman{{}}2{{}}3{{}}{{}}{2}{G}{{}}3{{}}Jesper Ejsing{{}}"<em>""I am neither their drover nor their leader. To these majestic beasts, I am simply their herdmate and nothing more.""</em>"{{}}G{{}}{{}}164{{}}C{{}}3.65{{}}|||7/1/2013 : If you don’t control any Beast creatures as your end step begins, the ability will be removed from the stack and will have no effect.{{}}{{}}At the beginning of your end step, put a +1/+1 counter on target Beast creature you control.{{}}164{{}}TRUE
23224{{}}370688{{}}Air Servant{{}}Magic 2014 Core Set{{}}M14{{}}Creature — Elemental{{}}4{{}}3{{}}{{}}{4}{U}{{}}5{{}}Lars Grant-West{{}}"<em>""Wind is forceful, yet ephemeral. It can knock a dragon out of the sky, yet pass through the smallest crack unhindered.""—Jestus Dreya, Of Elements and Eternity</em>"{{}}U{{}}{{}}42{{}}U{{}}3.529{{}}{{}}{{}}Flying|||{2}{U}: Tap target creature with flying.{{}}42{{}}TRUE
23225{{}}370680{{}}Ajani, Caller of the Pride{{}}Magic 2014 Core Set{{}}M14{{}}Planeswalker — Ajani{{}}{{}}{{}}4{{}}{1}{W}{W}{{}}3{{}}D. Alexander Gregory{{}}{{}}W{{}}{{}}1{{}}M{{}}3.929{{}}|||7/1/2012 : You can activate the first ability without a target. You'll still put one loyalty counter on Ajani when you activate the ability. |||7/1/2012 : The number of Cat tokens you put onto the battlefield is equal to your life total when the third ability resolves. |||7/1/2013 : Planeswalkers are permanents. You can cast one at the time you could cast a sorcery. When your planeswalker spell resolves, it enters the battlefield under your control. |||7/1/2013 : Planeswalkers are not creatures. Spells and abilities that affect creatures won’t affect them. |||7/1/2013 : Planeswalkers have loyalty. A planeswalker enters the battlefield with a number of loyalty counters on it equal to the number printed in its lower right corner. Activating one of its abilities may cause it to gain or lose loyalty counters. Damage dealt to a planeswalker causes that many loyalty counters to be removed from it. If it has no loyalty counters on it, it’s put into its owner’s graveyard as a state-based action. |||7/1/2013 : Planeswalkers each have a number of activated abilities called “loyalty abilities.” You can activate a loyalty ability of a planeswalker you control only at the time you could cast a sorcery and only if you haven’t activated one of that planeswalker’s loyalty abilities yet that turn. |||7/1/2013 : The cost to activate a planeswalker’s loyalty ability is represented by a symbol with a number inside. Up-arrows contain positive numbers, such as “+1”; this means “Put one loyalty counter on this planeswalker.” Down-arrows contain negative numbers, such as “-7”; this means “Remove seven loyalty counters from this planeswalker.” A symbol with a “0” means “Put zero loyalty counters on this planeswalker.” |||7/1/2013 : You can’t activate a planeswalker’s ability with a negative loyalty cost unless the planeswalker has at least that many loyalty counters on it. |||7/1/2013 : Planeswalkers can’t attack (unless an effect turns the planeswalker into a creature). However, they can be attacked. Each of your attacking creatures can attack your opponent or a planeswalker that player controls. You say which as you declare attackers. |||7/1/2013 : If your planeswalkers are being attacked, you can block the attackers as normal. |||7/1/2013 : If a creature that’s attacking a planeswalker isn’t blocked, it’ll deal its combat damage to that planeswalker. Damage dealt to a planeswalker causes that many loyalty counters to be removed from it. |||7/1/2013 : If a source you control would deal noncombat damage to an opponent, you may have that source deal that damage to a planeswalker that opponent controls instead. For example, although you can’t target a planeswalker with Shock, you can target your opponent with Shock, and then as Shock resolves, choose to have Shock deal its 2 damage to one of your opponent’s planeswalkers. (You can’t split up that damage between different players and/or planeswalkers.) If you have Shock deal its damage to a planeswalker, two loyalty counters are removed from it. |||7/1/2013 : If a player controls two or more planeswalkers that share a planeswalker type, that player chooses one of them and the rest are put into their owners’ graveyards as a state-based action.{{}}{{}}+1: Put a +1/+1 counter on up to one target creature.|||-3: Target creature gains flying and double strike until end of turn.|||-8: Put X 2/2 white Cat creature tokens onto the battlefield, where X is your life total.{{}}1{{}}TRUE
23226{{}}370750{{}}Ajani's Chosen{{}}Magic 2014 Core Set{{}}M14{{}}Creature — Cat Soldier{{}}3{{}}3{{}}{{}}{2}{W}{W}{{}}4{{}}Wayne Reynolds{{}}"<em>""United, our roar will level mountains.""</em>"{{}}W{{}}{{}}2{{}}R{{}}3.591{{}}{{}}{{}}Whenever an enchantment enters the battlefield under your control, put a 2/2 white Cat creature token onto the battlefield. If that enchantment is an Aura, you may attach it to the token.{{}}2{{}}TRUE
23227{{}}370677{{}}Altar's Reap{{}}Magic 2014 Core Set{{}}M14{{}}Instant{{}}{{}}{{}}{{}}{1}{B}{{}}2{{}}Donato Giancola{{}}"<em>""Don't worry, your death will be as informative as possible.""—Gorghul, augur of skulls</em>"{{}}B{{}}{{}}84{{}}C{{}}3.9{{}}|||4/15/2013 : You must sacrifice exactly one creature to cast this spell; you cannot cast it without sacrificing a creature, and you cannot sacrifice additional creatures. |||4/15/2013 : Players can only respond once this spell has been cast and all its costs have been paid. No one can try to destroy the creature you sacrificed to prevent you from casting this spell.{{}}{{}}As an additional cost to cast Altar's Reap, sacrifice a creature.|||Draw two cards.{{}}84{{}}TRUE
23228{{}}370612{{}}Angelic Accord{{}}Magic 2014 Core Set{{}}M14{{}}Enchantment{{}}{{}}{{}}{{}}{3}{W}{{}}4{{}}Michael C. Hayes{{}}<em>As demons are drawn to suffering, angels are drawn to acts of benevolence.</em>{{}}W{{}}{{}}3{{}}U{{}}3.738{{}}|||7/1/2013 : Angelic Accord’s ability checks how much life you’ve gained during the turn, not what your life total is compared to what it was when the turn began. For example, if you start the turn at 10 life, gain 6 life during the turn, then lose 6 life later that turn, the ability will trigger. |||7/1/2013 : If you haven’t gained 4 or more life during the turn when the end step begins, the ability won’t trigger at all. Gaining life during the end step won’t cause the ability to trigger. |||7/1/2013 : In a Two-Headed Giant game, life gained by your teammate isn’t considered, even though it causes your team’s life total to increase.{{}}{{}}At the beginning of each end step, if you gained 4 or more life this turn, put a 4/4 white Angel creature token with flying onto the battlefield.{{}}3{{}}TRUE
23229{{}}370789{{}}Angelic Wall{{}}Magic 2014 Core Set{{}}M14{{}}Creature — Wall{{}}0{{}}4{{}}{{}}{1}{W}{{}}2{{}}Allen Williams{{}}"<em>""The air stirred as if fanned by angels' wings, and the enemy was turned aside.""—Tales of Ikarov the Voyager</em>"{{}}W{{}}{{}}4{{}}C{{}}3.346{{}}{{}}{{}}Defender <em>(This creature can't attack.)</em>|||Flying{{}}4{{}}TRUE
23230{{}}370753{{}}Archaeomancer{{}}Magic 2014 Core Set{{}}M14{{}}Creature — Human Wizard{{}}1{{}}2{{}}{{}}{2}{U}{U}{{}}4{{}}Zoltan Boros{{}}"<em>""Words of power never disappear. They sleep, awaiting those with the will to rouse them.""</em>"{{}}U{{}}{{}}43{{}}C{{}}3.694{{}}|||7/1/2012 : If an instant or sorcery spell puts Archaeomancer onto the battlefield, you can return that card to your hand.{{}}{{}}When Archaeomancer enters the battlefield, return target instant or sorcery card from your graveyard to your hand.{{}}43{{}}TRUE
23231{{}}370627{{}}Archangel of Thune{{}}Magic 2014 Core Set{{}}M14{{}}Creature — Angel{{}}3{{}}4{{}}{{}}{3}{W}{W}{{}}5{{}}James Ryman{{}}<em>Even the wicked have nightmares.</em>{{}}W{{}}{{}}5{{}}M{{}}4.479{{}}|||7/1/2013 : The ability triggers just once from each life-gaining event, whether it’s 1 life from Soulmender or 5 life from Elixir of Immortality. |||7/1/2013 : A creature with lifelink dealing combat damage is a single life-gaining event. For example, if two creatures you control with lifelink deal combat damage at the same time, Archangel of Thune’s ability will trigger twice. However, if a single creature with lifelink deals combat damage to multiple creatures, players, and/or planeswalkers at the same time (perhaps because it has trample or was blocked by more than one creature), the ability will trigger only once. |||7/1/2013 : In a Two-Headed Giant game, life gained by your teammate won’t cause the ability to trigger, even though it causes your team’s life total to increase.{{}}{{}}Flying|||Lifelink <em>(Damage dealt by this creature also causes you to gain that much life.)</em>|||Whenever you gain life, put a +1/+1 counter on each creature you control.{{}}5{{}}TRUE
23232{{}}370632{{}}Armored Cancrix{{}}Magic 2014 Core Set{{}}M14{{}}Creature — Crab{{}}2{{}}5{{}}{{}}{4}{U}{{}}5{{}}Tomasz Jedruszek{{}}<em>Creatures displaced from time still turn up every year, stranded by the temporal disaster that once swept across Dominaria.</em>{{}}U{{}}{{}}44{{}}C{{}}1.139{{}}{{}}{{}}{{}}44{{}}TRUE
23233{{}}370634{{}}Artificer's Hex{{}}Magic 2014 Core Set{{}}M14{{}}Enchantment — Aura{{}}{{}}{{}}{{}}{B}{{}}1{{}}Franz Vohwinkel{{}}"<em>""Some treasures aren't worth finding, let alone stealing.""—Dack Fayden</em>"{{}}B{{}}{{}}85{{}}U{{}}3.167{{}}{{}}{{}}Enchant Equipment|||At the beginning of your upkeep, if enchanted Equipment is attached to a creature, destroy that creature.{{}}85{{}}TRUE
23234{{}}370793{{}}Auramancer{{}}Magic 2014 Core Set{{}}M14{{}}Creature — Human Wizard{{}}2{{}}2{{}}{{}}{2}{W}{{}}3{{}}Rebecca Guay{{}}"<em>""In memories, we can find our deepest reserves of strength.""</em>"{{}}W{{}}{{}}6{{}}C{{}}3.324{{}}{{}}{{}}When Auramancer enters the battlefield, you may return target enchantment card from your graveyard to your hand.{{}}6{{}}TRUE
23235{{}}370613{{}}Awaken the Ancient{{}}Magic 2014 Core Set{{}}M14{{}}Enchantment — Aura{{}}{{}}{{}}{{}}{1}{R}{R}{R}{{}}4{{}}Jaime Jones{{}}<em>Some days you stand to greet the horizon. Other days the horizon stands to greet you.</em>{{}}R{{}}{{}}126{{}}R{{}}3.788{{}}|||7/1/2013 : Awaken the Ancient can enchant any land with the subtype Mountain, not just one named Mountain. |||7/1/2013 : The enchanted Mountain retains any other types or subtypes it may have. You can still tap it to add {R} to your mana pool. It can be affected by anything that affects either a land or a creature. |||7/1/2013 : This doesn’t count as a creature entering the battlefield. The Mountain was already on the battlefield; it only changed types. |||7/1/2013 : If the enchanted Mountain stops being a Mountain for any reason, Awaken the Ancient will be put into its owner’s graveyard as a state-based action. |||7/1/2013 : Copies of the enchanted Mountain won’t be 7/7 red Giant creatures with haste. For example, if Awaken the Ancient is enchanting a basic Mountain, a copy of that creature would just be a basic Mountain.{{}}{{}}Enchant Mountain|||Enchanted Mountain is a 7/7 red Giant creature with haste. It's still a land.{{}}126{{}}TRUE
23236{{}}370624{{}}Banisher Priest{{}}Magic 2014 Core Set{{}}M14{{}}Creature — Human Cleric{{}}2{{}}2{{}}{{}}{1}{W}{W}{{}}3{{}}Willian Murai{{}}"<em>""Oathbreaker, I cast you out!""</em>"{{}}W{{}}{{}}7{{}}U{{}}3.783{{}}|||7/1/2013 : Banisher Priest’s ability causes a zone change with a duration, a new style of ability that’s somewhat reminiscent of older cards like Oblivion Ring. However, unlike Oblivion Ring, cards like Banisher Priest have a single ability that creates two one-shot effects: one that exiles the creature when the ability resolves, and another that returns the exiled card to the battlefield immediately after Banisher Priest leaves the battlefield. |||7/1/2013 : If Banisher Priest leaves the battlefield before its enters-the-battlefield ability resolves, the target creature won’t be exiled. |||7/1/2013 : Auras attached to the exiled creature will be put into their owners’ graveyards. Equipment attached to the exiled creature will become unattached and remain on the battlefield. Any counters on the exiled creature will cease to exist. |||7/1/2013 : If a creature token is exiled, it ceases to exist. It won’t be returned to the battlefield. |||7/1/2013 : The exiled card returns to the battlefield immediately after Banisher Priest leaves the battlefield. Nothing happens between the two events, including state-based actions. The two creatures aren’t on the battlefield at the same time. For example, if the returning creature is a Clone, it can’t enter the battlefield as a copy of Banisher Priest. |||7/1/2013 : In a multiplayer game, if Banisher Priest’s owner leaves the game, the exiled card will return to the battlefield. Because the one-shot effect that returns the card isn’t an ability that goes on the stack, it won’t cease to exist along with the leaving player’s spells and abilities on the stack.{{}}{{}}When Banisher Priest enters the battlefield, exile target creature an opponent controls until Banisher Priest leaves the battlefield. <em>(That creature returns under its owner's control.)</em>{{}}7{{}}TRUE
23237{{}}370822{{}}Barrage of Expendables{{}}Magic 2014 Core Set{{}}M14{{}}Enchantment{{}}{{}}{{}}{{}}{R}{{}}1{{}}Trevor Claxton{{}}<em>Goblin generals don't distinguish between troops and ammunition.</em>{{}}R{{}}{{}}127{{}}U{{}}3.696{{}}|||7/1/2013 : Barrage of Expendables deals the damage, not the sacrificed creature. Notably, that creature having deathtouch or lifelink provides no additional benefit. |||7/1/2013 : Because targets are chosen before costs are paid, it is possible to choose a creature as the target of the ability and then sacrifice that creature. The ability will be countered when it tries to resolve and no damage will be dealt.{{}}{{}}{R}, Sacrifice a creature: Barrage of Expendables deals 1 damage to target creature or player.{{}}127{{}}TRUE
23238{{}}370639{{}}Battle Sliver{{}}Magic 2014 Core Set{{}}M14{{}}Creature — Sliver{{}}3{{}}3{{}}{{}}{4}{R}{{}}5{{}}Slawomir Maniak{{}}"<em>""One emitted a strange series of buzzing clicks and guttural commands, then clawed arms emerged from all of them. Is there no limit to their adaptations?""—Hastric, Thunian scout</em>"{{}}R{{}}{{}}128{{}}U{{}}2.37{{}}|||7/1/2013 : If you change the creature type of a Sliver you control so it’s no longer a Sliver, it will no longer be affected by its own ability. Its ability will continue to affect other Sliver creatures you control. |||7/1/2013 : Abilities that Slivers grant, as well as power/toughness boosts, are cumulative. However, for some abilities, like flying, having more than one instance of the ability doesn’t provide any additional benefit.{{}}{{}}Sliver creatures you control get +2/+0.{{}}128{{}}TRUE
23239{{}}370819{{}}Blessing{{}}Magic 2014 Core Set{{}}M14{{}}Enchantment — Aura{{}}{{}}{{}}{{}}{W}{W}{{}}2{{}}Jason A. Engle{{}}"<em>""Virtue can't survive without strength.""—Ardanna of the Angelic Council</em>"{{}}W{{}}{{}}8{{}}U{{}}3.333{{}}{{}}{{}}Enchant creature|||{W}: Enchanted creature gets +1/+1 until end of turn.{{}}8{{}}TRUE
23240{{}}370761{{}}Blightcaster{{}}Magic 2014 Core Set{{}}M14{{}}Creature — Human Wizard{{}}2{{}}3{{}}{{}}{3}{B}{{}}4{{}}Winona Nelson{{}}"<em>""Your flesh is unprepared for my gifts.""</em>"{{}}B{{}}{{}}86{{}}U{{}}3.412{{}}|||7/1/2013 : Blightcaster’s ability will resolve before the enchantment spell that caused it to trigger. |||7/1/2013 : If you are the only player who controls a creature when Blightcaster’s ability triggers, you must choose one as the target, although you can choose not to give it -2/-2.{{}}{{}}Whenever you cast an enchantment spell, you may have target creature get -2/-2 until end of turn.{{}}86{{}}TRUE
23241{{}}370698{{}}Blood Bairn{{}}Magic 2014 Core Set{{}}M14{{}}Creature — Vampire{{}}2{{}}2{{}}{{}}{2}{B}{{}}3{{}}Ryan Yee{{}}<em>The travelers were warned to watch out for children on the road.</em>{{}}B{{}}{{}}87{{}}C{{}}3.375{{}}{{}}{{}}Sacrifice another creature: Blood Bairn gets +2/+2 until end of turn.{{}}87{{}}TRUE
23242{{}}370593{{}}Blur Sliver{{}}Magic 2014 Core Set{{}}M14{{}}Creature — Sliver{{}}2{{}}2{{}}{{}}{2}{R}{{}}3{{}}Daarken{{}}<em>They move in a synchronized swarm, turning entire squads into heaps of bloody rags and bones in an instant.</em>{{}}R{{}}{{}}129{{}}C{{}}2.964{{}}|||7/1/2013 : If Blur Sliver leaves the battlefield during combat, any attacking Sliver creatures that came under your control this turn will continue to attack, even though they will no longer have haste. |||7/1/2013 : If you change the creature type of a Sliver you control so it’s no longer a Sliver, it will no longer be affected by its own ability. Its ability will continue to affect other Sliver creatures you control. |||7/1/2013 : Abilities that Slivers grant, as well as power/toughness boosts, are cumulative. However, for some abilities, like flying, having more than one instance of the ability doesn’t provide any additional benefit.{{}}{{}}Sliver creatures you control have haste. <em>(They can attack and {T} as soon as they come under your control.)</em>{{}}129{{}}TRUE
23243{{}}370758{{}}Bogbrew Witch{{}}Magic 2014 Core Set{{}}M14{{}}Creature — Human Wizard{{}}1{{}}3{{}}{{}}{3}{B}{{}}4{{}}Eric Deschamps{{}}"<em>""The hardest thing is finding the right ingredients.""</em>"{{}}B{{}}{{}}88{{}}R{{}}2.87{{}}|||7/1/2013 : You don’t have to declare which card you’re searching for when you activate the ability. |||7/1/2013 : You put only one card onto the battlefield as the activated ability resolves.{{}}{{}}{2}, {T}: Search your library for a card named Festering Newt or Bubbling Cauldron, put it onto the battlefield tapped, then shuffle your library.{{}}88{{}}TRUE
23244{{}}370801{{}}Bonescythe Sliver{{}}Magic 2014 Core Set{{}}M14{{}}Creature — Sliver{{}}2{{}}2{{}}{{}}{3}{W}{{}}4{{}}Trevor Claxton{{}}"<em>""Their appendages are sharper than our swords and quicker than our bows.""—Hastric, Thunian scout</em>"{{}}W{{}}{{}}9{{}}R{{}}3.5{{}}|||7/1/2013 : If Bonescythe Sliver leaves the battlefield after other Sliver creatures you control have dealt first-strike damage but before regular combat damage, those Slivers won’t deal regular combat damage (unless they still have double strike for some other reason). |||7/1/2013 : If you change the creature type of a Sliver you control so it’s no longer a Sliver, it will no longer be affected by its own ability. Its ability will continue to affect other Sliver creatures you control. |||7/1/2013 : Abilities that Slivers grant, as well as power/toughness boosts, are cumulative. However, for some abilities, like flying, having more than one instance of the ability doesn’t provide any additional benefit.{{}}{{}}Sliver creatures you control have double strike. <em>(They deal both first-strike and regular combat damage.)</em>{{}}9{{}}TRUE
23245{{}}370642{{}}Bramblecrush{{}}Magic 2014 Core Set{{}}M14{{}}Sorcery{{}}{{}}{{}}{{}}{2}{G}{G}{{}}4{{}}Drew Baker{{}}<em>Nature abhors a lot of things.</em>{{}}G{{}}{{}}165{{}}U{{}}3.595{{}}{{}}{{}}Destroy target noncreature permanent.{{}}165{{}}TRUE
23246{{}}370816{{}}Brave the Elements{{}}Magic 2014 Core Set{{}}M14{{}}Instant{{}}{{}}{{}}{{}}{W}{{}}1{{}}Goran Josic{{}}{{}}W{{}}{{}}10{{}}U{{}}4.28{{}}|||10/1/2009 : You choose a color as Brave the Elements resolves. Once the color is chosen, it's too late for players to respond. |||10/1/2009 : Only white creatures you control at the time Brave the Elements resolves gain the protection ability. Creatures that come under your control later in the turn, or that turn white later in the turn, won't have it.{{}}{{}}Choose a color. White creatures you control gain protection from the chosen color until end of turn. <em>(They can't be blocked, targeted, dealt damage, or enchanted by anything of that color.)</em>{{}}10{{}}TRUE
23247{{}}370739{{}}Briarpack Alpha{{}}Magic 2014 Core Set{{}}M14{{}}Creature — Wolf{{}}3{{}}3{{}}{{}}{3}{G}{{}}4{{}}Daarken{{}}"<em>""One of my greatest teachers.""—Garruk Wildspeaker</em>"{{}}G{{}}{{}}166{{}}U{{}}3.688{{}}{{}}{{}}Flash <em>(You may cast this spell any time you could cast an instant.)</em>|||When Briarpack Alpha enters the battlefield, target creature gets +2/+2 until end of turn.{{}}166{{}}TRUE
23248{{}}370778{{}}Brindle Boar{{}}Magic 2014 Core Set{{}}M14{{}}Creature — Boar{{}}2{{}}2{{}}{{}}{2}{G}{{}}3{{}}Dave Allsop{{}}"<em>""Tell the cooks to prepare the fires. Tonight we feast!""—Tolar Wolfbrother, Krosan tracker</em>"{{}}G{{}}{{}}167{{}}C{{}}3.321{{}}|||8/15/2010 : If you sacrifice an attacking or blocking Brindle Boar during the declare blockers step, it won't deal combat damage. If you wait until the combat damage step, but Brindle Boar is dealt lethal damage, it'll be destroyed before you get a chance to sacrifice it.{{}}{{}}Sacrifice Brindle Boar: You gain 4 life.{{}}167{{}}TRUE
23249{{}}370661{{}}Bubbling Cauldron{{}}Magic 2014 Core Set{{}}M14{{}}Artifact{{}}{{}}{{}}{{}}{2}{{}}2{{}}Eric Deschamps{{}}{{}}A{{}}{{}}205{{}}U{{}}3.476{{}}{{}}{{}}{1}, {T}, Sacrifice a creature: You gain 4 life.|||{1}, {T}, Sacrifice a creature named Festering Newt: Each opponent loses 4 life. You gain life equal to the life lost this way.{{}}205{{}}TRUE
23250{{}}370696{{}}Burning Earth{{}}Magic 2014 Core Set{{}}M14{{}}Enchantment{{}}{{}}{{}}{{}}{3}{R}{{}}4{{}}rk post{{}}"<em>""Your world is formed from the same power that wraps my burning hand around your throat.""—Shrazik, lavamancer</em>"{{}}R{{}}{{}}130{{}}R{{}}3.154{{}}|||7/1/2013 : To tap a land for mana is to activate one of that land’s mana abilities that has {T} in its activation cost. |||7/1/2013 : The ability will trigger each time a nonbasic land is tapped for mana. Each of these abilities goes on the stack and resolves separately. |||7/1/2013 : If any nonbasic lands are tapped for mana while a player is casting a spell or activating an ability, Burning Earth’s ability will trigger that many times and wait. When the player finishes casting that spell or activating that ability, Burning Earth’s triggered abilities are put on the stack on top of it. Burning Earth’s abilities will resolve first. |||7/1/2013 : On the other hand, a player can tap nonbasic lands for mana, put the Burning Earth triggered abilities on the stack, and then respond to those abilities by casting an instant spell or activating an ability using that mana. In that case, the instant spell or activated ability will resolve first.{{}}{{}}Whenever a player taps a nonbasic land for mana, Burning Earth deals 1 damage to that player.{{}}130{{}}TRUE
23251{{}}370755{{}}Cancel{{}}Magic 2014 Core Set{{}}M14{{}}Instant{{}}{{}}{{}}{{}}{1}{U}{U}{{}}3{{}}David Palumbo{{}}{{}}U{{}}{{}}45{{}}C{{}}2.6{{}}{{}}{{}}Counter target spell.{{}}45{{}}TRUE
23252{{}}370757{{}}Canyon Minotaur{{}}Magic 2014 Core Set{{}}M14{{}}Creature — Minotaur Warrior{{}}3{{}}3{{}}{{}}{3}{R}{{}}4{{}}Steve Prescott{{}}"<em>""We'll scale these cliffs, traverse Brittle Bridge, and then fight our way down the volcanic slopes on the other side.""""Isn't the shortest route through the canyon?""""Yes.""""So shouldn't we—""""No.""</em>"{{}}R{{}}{{}}131{{}}C{{}}1.467{{}}{{}}{{}}{{}}131{{}}TRUE
