23350{{}}370733{{}}Mutavault{{}}Magic 2014 Core Set{{}}M14{{}}Land{{}}{{}}{{}}{{}}{{}}0{{}}Fred Fields{{}}<em>Some worlds possess a hidden core where life's essence constantly surges.</em>{{}}L{{}}{X}{{}}228{{}}R{{}}4.149{{}}|||4/1/2008 : Although Mutavault has all creature types while it's animated, it does not have the changeling keyword ability. |||8/1/2008 : A noncreature permanent that turns into a creature can attack, and its {T} abilities can be activated, only if its controller has continuously controlled that permanent since the beginning of his or her most recent turn. It doesn't matter how long the permanent has been a creature. |||7/1/2013 : Examples of creature types include Sliver, Goblin, and Soldier. Creature types appear after the dash on the type line of creatures.{{}}{{}}{T}: Add {1} to your mana pool.|||{1}: Mutavault becomes a 2/2 creature with all creature types until end of turn. It's still a land.{{}}228{{}}TRUE
23351{{}}370802{{}}Naturalize{{}}Magic 2014 Core Set{{}}M14{{}}Instant{{}}{{}}{{}}{{}}{1}{G}{{}}2{{}}Tim Hildebrandt{{}}"<em>""When your cities and trinkets crumble, only nature will remain.""—Garruk Wildspeaker</em>"{{}}G{{}}{{}}186{{}}C{{}}2.176{{}}{{}}{{}}Destroy target artifact or enchantment.{{}}186{{}}TRUE
23352{{}}370719{{}}Negate{{}}Magic 2014 Core Set{{}}M14{{}}Instant{{}}{{}}{{}}{{}}{1}{U}{{}}2{{}}Jeremy Jarvis{{}}<em>Masters of the arcane savor a delicious irony. Their study of deep and complex arcana leads to such a simple end: the ability to say merely yes or no.</em>{{}}U{{}}{{}}64{{}}C{{}}4{{}}"|||10/1/2009 : A ""creature spell"" is any spell with the type Creature, even if it has other types such as Artifact or Enchantment. Older cards of type Summon are also Creature spells."{{}}{{}}Counter target noncreature spell.{{}}64{{}}TRUE
23353{{}}370760{{}}Nephalia Seakite{{}}Magic 2014 Core Set{{}}M14{{}}Creature — Bird{{}}2{{}}3{{}}{{}}{3}{U}{{}}4{{}}Wayne England{{}}"<em>""Keep one eye on the cliff road or you may fall to your death. Keep one eye on the sky or your death may fall on you.""—Manfried Ulmach, Elgaud Master-at-Arms</em>"{{}}U{{}}{{}}65{{}}C{{}}3.5{{}}{{}}{{}}Flash <em>(You may cast this spell any time you could cast an instant.)</em>|||Flying{{}}65{{}}TRUE
23354{{}}370689{{}}Nightmare{{}}Magic 2014 Core Set{{}}M14{{}}Creature — Nightmare Horse{{}}*{{}}*{{}}{{}}{5}{B}{{}}6{{}}Vance Kovacs{{}}<em>The thunder of its hooves beats dreams into despair.</em>{{}}B{{}}{{}}108{{}}R{{}}4.019{{}}|||4/1/2008 : If you control 0 swamps, then the Nightmare has 0 toughness and will be put into its owner's graveyard as a state-based action right before the next player gains priority. |||10/1/2009 : Nightmare's power and toughness changes as the number of Swamps you control changes. |||7/1/2013 : The ability that defines Nightmare’s power and toughness works everywhere, not just on the battlefield. |||7/1/2013 : Nightmare’s ability counts all lands you control with the subtype Swamp, not just ones named Swamp.{{}}{{}}Flying|||Nightmare's power and toughness are each equal to the number of Swamps you control.{{}}108{{}}TRUE
23355{{}}370705{{}}Nightwing Shade{{}}Magic 2014 Core Set{{}}M14{{}}Creature — Shade{{}}2{{}}2{{}}{{}}{4}{B}{{}}5{{}}Lucas Graciano{{}}"<em>""There is one hour of the night even we do not watch.""—Sedva, captain of the watch</em>"{{}}B{{}}{{}}109{{}}C{{}}1.654{{}}{{}}{{}}Flying|||{1}{B}: Nightwing Shade gets +1/+1 until end of turn.{{}}109{{}}TRUE
23356{{}}370763{{}}Oath of the Ancient Wood{{}}Magic 2014 Core Set{{}}M14{{}}Enchantment{{}}{{}}{{}}{{}}{2}{G}{{}}3{{}}Dan Scott{{}}"<em>""Some gaze upon the forest and see trees. I see true power.""</em>"{{}}G{{}}{{}}187{{}}R{{}}1.733{{}}|||7/1/2013 : If the enchantment that enters the battlefield is somehow also a creature, you may choose it as the target of Oath of the Ancient Wood’s ability.{{}}{{}}Whenever Oath of the Ancient Wood or another enchantment enters the battlefield under your control, you may put a +1/+1 counter on target creature.{{}}187{{}}TRUE
23357{{}}370662{{}}Ogre Battledriver{{}}Magic 2014 Core Set{{}}M14{{}}Creature — Ogre Warrior{{}}3{{}}3{{}}{{}}{2}{R}{R}{{}}4{{}}Greg Staples{{}}<em>Ogres are driven by passion, rage, and another ogre standing behind them with a whip.</em>{{}}R{{}}{{}}148{{}}R{{}}4.148{{}}{{}}{{}}Whenever another creature enters the battlefield under your control, that creature gets +2/+0 and gains haste until end of turn. <em>(It can attack and {T} this turn.)</em>{{}}148{{}}TRUE
23358{{}}370751{{}}Opportunity{{}}Magic 2014 Core Set{{}}M14{{}}Instant{{}}{{}}{{}}{{}}{4}{U}{U}{{}}6{{}}Allen Williams{{}}"<em>""Opportunity isn't something you wait for. It's something you create.""</em>"{{}}U{{}}{{}}66{{}}U{{}}3.694{{}}{{}}{{}}Target player draws four cards.{{}}66{{}}TRUE
23359{{}}370812{{}}Pacifism{{}}Magic 2014 Core Set{{}}M14{{}}Enchantment — Aura{{}}{{}}{{}}{{}}{1}{W}{{}}2{{}}Robert Bliss{{}}<em>For the first time in his life, Grakk felt a little warm and fuzzy inside.</em>{{}}W{{}}{{}}25{{}}C{{}}3.812{{}}{{}}{{}}Enchant creature|||Enchanted creature can't attack or block.{{}}25{{}}TRUE
23360{{}}370798{{}}Path of Bravery{{}}Magic 2014 Core Set{{}}M14{{}}Enchantment{{}}{{}}{{}}{{}}{2}{W}{{}}3{{}}Chris Rahn{{}}{{}}W{{}}{{}}26{{}}R{{}}4.056{{}}|||7/1/2013 : Your starting life total is the life total you began the game with, keeping in mind the format you’re playing and, in some rare cases, anything that affects your starting life total (for example, a vanguard with a life modifier). |||7/1/2013 : In most games, your starting life total is 20. In a Commander game, your starting life total is 40 instead. In a Two-Headed Giant game, Path of Bravery compares your team’s life total to your team’s starting life total, which is 30. |||7/1/2013 : Path of Bravery’s triggered ability triggers only once, after attacking creatures are declared. For example, if you attack with five creatures, you’ll gain 5 life as a single life-gain event. |||7/1/2013 : If a creature enters the battlefield attacking after attacking creatures have been declared, the ability won’t trigger again because you didn’t declare that creature as an attacking creature. However, if enters the battlefield before the ability resolves, it will be counted when determining how much life is gained.{{}}{{}}As long as your life total is greater than or equal to your starting life total, creatures you control get +1/+1.|||Whenever one or more creatures you control attack, you gain life equal to the number of attacking creatures.{{}}26{{}}TRUE
23361{{}}370742{{}}Pay No Heed{{}}Magic 2014 Core Set{{}}M14{{}}Instant{{}}{{}}{{}}{{}}{W}{{}}1{{}}Adam Rex{{}}"<em>""Out of this nettle, danger, we pluck this flower, safety.""—William Shakespeare, King Henry IV, Part I</em>"{{}}W{{}}{{}}27{{}}C{{}}2.5{{}}|||7/1/2013 : Pay No Heed doesn’t target anything. You can choose a source with hexproof, for example. You choose the damage source as Pay No Heed resolves. |||7/1/2013 : If the chosen source is a permanent spell, damage dealt later in the turn by the permanent it becomes will also be prevented.{{}}{{}}Prevent all damage a source of your choice would deal this turn.{{}}27{{}}TRUE
23362{{}}370650{{}}Phantom Warrior{{}}Magic 2014 Core Set{{}}M14{{}}Creature — Illusion Warrior{{}}2{{}}2{{}}{{}}{1}{U}{U}{{}}3{{}}Greg Staples{{}}"<em>""The construction of a defense is not accomplished by adding bricks.""—Jace Beleren</em>"{{}}U{{}}{{}}67{{}}U{{}}4.05{{}}{{}}{{}}Phantom Warrior can't be blocked.{{}}67{{}}TRUE
23363{{}}370765{{}}Pillarfield Ox{{}}Magic 2014 Core Set{{}}M14{{}}Creature — Ox{{}}2{{}}4{{}}{{}}{3}{W}{{}}4{{}}Andrew Robinson{{}}"<em>""You old, immobile clod! If I could stuff your doltish head with knowledge, I'd do it just so someone else could fully comprehend what your stubbornness has cost me!""—Bruse Tarl, Goma Fada nomad</em>"{{}}W{{}}{{}}28{{}}C{{}}1.75{{}}{{}}{{}}{{}}28{{}}TRUE
23364{{}}370649{{}}Pitchburn Devils{{}}Magic 2014 Core Set{{}}M14{{}}Creature — Devil{{}}3{{}}3{{}}{{}}{4}{R}{{}}5{{}}Johann Bodin{{}}<em>The ingenuity of goblins, the depravity of demons, and the smarts of sheep.</em>{{}}R{{}}{{}}149{{}}C{{}}2.5{{}}{{}}{{}}When Pitchburn Devils dies, it deals 3 damage to target creature or player.{{}}149{{}}TRUE
23365{{}}370669{{}}Plains{{}}Magic 2014 Core Set{{}}M14{{}}Basic Land — Plains{{}}{{}}{{}}{{}}{{}}0{{}}Andreas Rocha{{}}{{}}L{{}}{W}{{}}233{{}}C{{}}2.583{{}}{{}}2{{}}{W}{{}}233{{}}TRUE
23366{{}}370808{{}}Planar Cleansing{{}}Magic 2014 Core Set{{}}M14{{}}Sorcery{{}}{{}}{{}}{{}}{3}{W}{W}{W}{{}}6{{}}Michael Komarck{{}}{{}}W{{}}{{}}29{{}}R{{}}3.708{{}}{{}}{{}}Destroy all nonland permanents.{{}}29{{}}TRUE
23367{{}}370601{{}}Plummet{{}}Magic 2014 Core Set{{}}M14{{}}Instant{{}}{{}}{{}}{{}}{1}{G}{{}}2{{}}Pete Venters{{}}"<em>""Let nothing own the skies but the wind.""—Dejara, Giltwood druid</em>"{{}}G{{}}{{}}188{{}}C{{}}3.455{{}}{{}}{{}}Destroy target creature with flying.{{}}188{{}}TRUE
23368{{}}370745{{}}Predatory Sliver{{}}Magic 2014 Core Set{{}}M14{{}}Creature — Sliver{{}}1{{}}1{{}}{{}}{1}{G}{{}}2{{}}Mathias Kollros{{}}<em>No matter how much the slivers change, their collective might remains.</em>{{}}G{{}}{{}}189{{}}C{{}}3.727{{}}|||7/1/2013 : If you change the creature type of a Sliver you control so it’s no longer a Sliver, it will no longer be affected by its own ability. Its ability will continue to affect other Sliver creatures you control. |||7/1/2013 : Abilities that Slivers grant, as well as power/toughness boosts, are cumulative. However, for some abilities, like flying, having more than one instance of the ability doesn’t provide any additional benefit.{{}}{{}}Sliver creatures you control get +1/+1.{{}}189{{}}TRUE
23369{{}}370656{{}}Primeval Bounty{{}}Magic 2014 Core Set{{}}M14{{}}Enchantment{{}}{{}}{{}}{{}}{5}{G}{{}}6{{}}Christine Choi{{}}{{}}G{{}}{{}}190{{}}M{{}}4.15{{}}|||7/1/2013 : The last ability triggers whenever you play a land and also whenever a land enters the battlefield under your control for some other reason, such as the ability of Into the Wilds.{{}}{{}}Whenever you cast a creature spell, put a 3/3 green Beast creature token onto the battlefield.|||Whenever you cast a noncreature spell, put three +1/+1 counters on target creature you control.|||Whenever a land enters the battlefield under your control, you gain 3 life.{{}}190{{}}TRUE
23370{{}}370686{{}}Pyromancer's Gauntlet{{}}Magic 2014 Core Set{{}}M14{{}}Artifact{{}}{{}}{{}}{{}}{5}{{}}5{{}}Christine Choi{{}}<em>An inferno is just a gesture away.</em>{{}}A{{}}{{}}214{{}}R{{}}3.481{{}}{{}}{{}}If a red instant or sorcery spell you control or a red planeswalker you control would deal damage to a permanent or player, it deals that much damage plus 2 to that permanent or player instead.{{}}214{{}}TRUE
23371{{}}370714{{}}Quag Sickness{{}}Magic 2014 Core Set{{}}M14{{}}Enchantment — Aura{{}}{{}}{{}}{{}}{2}{B}{{}}3{{}}Martina Pilcerova{{}}<em>The dread gases didn't kill Farbid. But as he lay in the muck, miserable and helpless, watching ghouls and rats advance on him, he wished they had.</em>{{}}B{{}}{{}}110{{}}C{{}}3.45{{}}|||8/15/2010 : This ability counts the number of Swamps controlled by Quag Sickness's controller, not the enchanted creature's controller (in case they're different players). |||8/15/2010 : This bonus is not fixed; it changes as the number of Swamps you control changes. |||8/15/2010 : The ability cares about lands with the land type Swamp, not necessarily lands named Swamp.{{}}{{}}Enchant creature|||Enchanted creature gets -1/-1 for each Swamp you control.{{}}110{{}}TRUE
23372{{}}370644{{}}Quicken{{}}Magic 2014 Core Set{{}}M14{{}}Instant{{}}{{}}{{}}{{}}{U}{{}}1{{}}Aleksi Briclot{{}}<em>A skilled Izzet chronarch can carry out an epic vendetta between the fall of one hourglass grain and the next.</em>{{}}U{{}}{{}}68{{}}R{{}}4.259{{}}|||2/1/2006 : You don't choose a sorcery card when Quicken resolves. Rather, this sets up a rule that is true for you until the turn ends or until you cast a sorcery card, even if you cast that sorcery at a time you normally could. |||2/1/2006 : If you cast multiple Quickens on the same turn, they'll all apply to the very next sorcery spell you cast. |||9/25/2006 : After Quicken resolves, you can Suspend a Sorcery in your hand any time you can cast an Instant.  As soon as you actually cast a Sorcery, you lose this capability. |||7/1/2013 : Casting a copy of a sorcery card won’t “use up” Quicken’s effect because the copy isn’t a card.{{}}{{}}The next sorcery card you cast this turn can be cast as though it had flash. <em>(It can be cast any time you could cast an instant.)</em>|||Draw a card.{{}}68{{}}TRUE
23373{{}}370803{{}}Ranger's Guile{{}}Magic 2014 Core Set{{}}M14{{}}Instant{{}}{{}}{{}}{{}}{G}{{}}1{{}}Steve Prescott{{}}"<em>""You don't survive in the wild by standing in plain sight.""—Garruk Wildspeaker</em>"{{}}G{{}}{{}}191{{}}C{{}}3.462{{}}{{}}{{}}Target creature you control gets +1/+1 and gains hexproof until end of turn. <em>(It can't be the target of spells or abilities your opponents control.)</em>{{}}191{{}}TRUE
23374{{}}370623{{}}Ratchet Bomb{{}}Magic 2014 Core Set{{}}M14{{}}Artifact{{}}{{}}{{}}{{}}{2}{{}}2{{}}Austin Hsu{{}}{{}}A{{}}{{}}215{{}}R{{}}4.405{{}}|||1/1/2011 : As Ratchet Bomb's last ability resolves, its last existence on the battlefield is checked to determine how many charge counters were on it. |||1/1/2011 : Ratchet Bomb's second ability destroys only those nonland permanents whose converted mana cost is exactly equal to the number of charge counters on Ratchet Bomb. It doesn't matter who controls them. |||1/1/2011 : If Ratchet Bomb's second ability is activated while it has no charge counters on it, it will destroy each nonland permanent with converted mana cost 0. |||1/1/2011 : The converted mana cost of a permanent is determined solely by the mana symbols printed in its upper right corner, unless it's copying something else (see below). The converted mana cost is the total amount of mana in that cost, regardless of color. For example, a card with mana cost {3}{U}{U} has converted mana cost 5. |||1/1/2011 : If a permanent is copying something else, its converted mana cost is the converted mana cost of whatever it's copying. |||1/1/2011 : In all cases, ignore any alternative costs or additional costs (such as kicker) paid when the permanent was cast. |||1/1/2011 : If the mana cost of a permanent includes {X}, X is considered to be 0. |||1/1/2011 : If a nonland permanent has no mana symbols in its upper right corner (because it's a token that's not copying something else, for example), its converted mana cost is 0.{{}}{{}}{T}: Put a charge counter on Ratchet Bomb.|||{T}, Sacrifice Ratchet Bomb: Destroy each nonland permanent with converted mana cost equal to the number of charge counters on Ratchet Bomb.{{}}215{{}}TRUE
23375{{}}370805{{}}Regathan Firecat{{}}Magic 2014 Core Set{{}}M14{{}}Creature — Elemental Cat{{}}4{{}}1{{}}{{}}{2}{R}{{}}3{{}}Eric Velhagen{{}}<em>It stalks the Regathan highlands, leaving behind melted snow, scorched earth, and the charred corpses of would-be temple robbers.</em>{{}}R{{}}{{}}150{{}}C{{}}3.184{{}}{{}}{{}}{{}}150{{}}TRUE
23376{{}}370580{{}}Ring of Three Wishes{{}}Magic 2014 Core Set{{}}M14{{}}Artifact{{}}{{}}{{}}{{}}{5}{{}}5{{}}Mark Winters{{}}{{}}A{{}}{{}}216{{}}M{{}}3.614{{}}{{}}{{}}Ring of Three Wishes enters the battlefield with three wish counters on it.|||{5}, {T}, Remove a wish counter from Ring of Three Wishes: Search your library for a card and put that card into your hand. Then shuffle your library.{{}}216{{}}TRUE
23377{{}}370636{{}}Rise of the Dark Realms{{}}Magic 2014 Core Set{{}}M14{{}}Sorcery{{}}{{}}{{}}{{}}{7}{B}{B}{{}}9{{}}Michael Komarck{{}}"<em>""For every living person there are generations of dead. Which realm would you rather rule?""—Liliana Vess</em>"{{}}B{{}}{{}}111{{}}M{{}}3.697{{}}{{}}{{}}Put all creature cards from all graveyards onto the battlefield under your control.{{}}111{{}}TRUE
23378{{}}370668{{}}Rod of Ruin{{}}Magic 2014 Core Set{{}}M14{{}}Artifact{{}}{{}}{{}}{{}}{4}{{}}4{{}}Mark Zug{{}}<em>The good news is it's so simple a goblin could use it. The bad news is it's so simple a goblin could use it.</em>{{}}A{{}}{{}}217{{}}U{{}}1.171{{}}{{}}{{}}{3}, {T}: Rod of Ruin deals 1 damage to target creature or player.{{}}217{{}}TRUE
23379{{}}370693{{}}Rootwalla{{}}Magic 2014 Core Set{{}}M14{{}}Creature — Lizard{{}}2{{}}2{{}}{{}}{2}{G}{{}}3{{}}Roger Raupp{{}}<em>They make terrible pets . . . unless you don't like your other pets.</em>{{}}G{{}}{{}}192{{}}C{{}}2.875{{}}|||2/1/2006 : If this card's ability is activated by one player, then another player takes control of it on the same turn, the second player can't activate its ability that turn.{{}}{{}}{1}{G}: Rootwalla gets +2/+2 until end of turn. Activate this ability only once each turn.{{}}192{{}}TRUE
23380{{}}370764{{}}Rumbling Baloth{{}}Magic 2014 Core Set{{}}M14{{}}Creature — Beast{{}}4{{}}4{{}}{{}}{2}{G}{G}{{}}4{{}}Jesper Ejsing{{}}<em>In the dim light beneath the vast trees of Deepglade, baloths prowl in search of prey. Their guttural calls are more felt than heard, but their attack scream carries for miles.</em>{{}}G{{}}{{}}193{{}}C{{}}2.842{{}}{{}}{{}}{{}}193{{}}TRUE
23381{{}}370671{{}}Sanguine Bond{{}}Magic 2014 Core Set{{}}M14{{}}Enchantment{{}}{{}}{{}}{{}}{3}{B}{B}{{}}5{{}}Jaime Jones{{}}"<em>""Blood is constant. Every drop I drink, someone must bleed.""—Vradeen, vampire nocturnus</em>"{{}}B{{}}{{}}112{{}}R{{}}4.079{{}}|||10/1/2009 : Sanguine Bond's ability triggers just once for each life-gaining event, whether it's 1 life from Soul Warden or 8 life from Tendrils of Corruption.{{}}{{}}Whenever you gain life, target opponent loses that much life.{{}}112{{}}TRUE
23382{{}}370710{{}}Savage Summoning{{}}Magic 2014 Core Set{{}}M14{{}}Instant{{}}{{}}{{}}{{}}{G}{{}}1{{}}Johann Bodin{{}}{{}}G{{}}{{}}194{{}}R{{}}4.24{{}}|||7/1/2013 : You don’t choose a creature card when Savage Summoning resolves. Rather, it applies to the next creature card you cast that turn, even if you cast it at a time when you normally could cast a creature and even if you cast it from a zone other than your hand. |||7/1/2013 : If you cast multiple Savage Summonings in succession, they’ll apply to the next creature spell you cast. That creature will enter the battlefield with that many additional +1/+1 counters on it. |||7/1/2013 : Spells that would counter Savage Summoning or the relevant creature spell can still be cast. They won’t counter the spell, but any additional effects they have will happen.{{}}{{}}Savage Summoning can't be countered.|||The next creature card you cast this turn can be cast as though it had flash. That spell can't be countered. That creature enters the battlefield with an additional +1/+1 counter on it.{{}}194{{}}TRUE
23383{{}}370629{{}}Scavenging Ooze{{}}Magic 2014 Core Set{{}}M14{{}}Creature — Ooze{{}}2{{}}2{{}}{{}}{1}{G}{{}}2{{}}Austin Hsu{{}}<em>In nature, not a single bone or scrap of flesh goes to waste.</em>{{}}G{{}}{{}}195{{}}R{{}}4.526{{}}|||7/1/2013 : If the target card is an illegal target when the ability tries to resolve, it will be countered and none of its effects will happen. No counter will be put on Scavenging Ooze and you won’t gain life.{{}}{{}}{G}: Exile target card from a graveyard. If it was a creature card, put a +1/+1 counter on Scavenging Ooze and you gain 1 life.{{}}195{{}}TRUE
23384{{}}370584{{}}Scourge of Valkas{{}}Magic 2014 Core Set{{}}M14{{}}Creature — Dragon{{}}4{{}}4{{}}{{}}{2}{R}{R}{R}{{}}5{{}}Lucas Graciano{{}}{{}}R{{}}{{}}151{{}}M{{}}3.833{{}}|||7/1/2013 : The amount of damage dealt by the Dragon that entered the battlefield is based on the number of Dragons you control when the ability resolves.{{}}{{}}Flying|||Whenever Scourge of Valkas or another Dragon enters the battlefield under your control, it deals X damage to target creature or player, where X is the number of Dragons you control.|||{R}: Scourge of Valkas gets +1/+0 until end of turn.{{}}151{{}}TRUE
23385{{}}370651{{}}Scroll Thief{{}}Magic 2014 Core Set{{}}M14{{}}Creature — Merfolk Rogue{{}}1{{}}3{{}}{{}}{2}{U}{{}}3{{}}Alex Horley-Orlandelli{{}}<em>Kapsho merfolk have infiltrated fortresses as remote as the desert citadel in Sunari in their relentless quest for arcane knowledge.</em>{{}}U{{}}{{}}69{{}}C{{}}3.3{{}}|||8/15/2010 : The ability triggers just once each time Scroll Thief deals combat damage to a player, regardless of how much damage it deals. |||8/15/2010 : The ability is mandatory. You must draw a card when it resolves.{{}}{{}}Whenever Scroll Thief deals combat damage to a player, draw a card.{{}}69{{}}TRUE
23386{{}}370617{{}}Seacoast Drake{{}}Magic 2014 Core Set{{}}M14{{}}Creature — Drake{{}}1{{}}3{{}}{{}}{1}{U}{{}}2{{}}Scott Chou{{}}<em>Seacoast drakes have been known to follow ships for hundreds of miles, waiting to snap up garbage, bait, and the occasional sailor.</em>{{}}U{{}}{{}}70{{}}C{{}}3.667{{}}{{}}{{}}Flying{{}}70{{}}TRUE
23387{{}}370713{{}}Seismic Stomp{{}}Magic 2014 Core Set{{}}M14{{}}Sorcery{{}}{{}}{{}}{{}}{1}{R}{{}}2{{}}Chase Stone{{}}"<em>""It is not in me to tread lightly.""—Ryda, geomancer</em>"{{}}R{{}}{{}}152{{}}C{{}}3.389{{}}|||7/1/2013 : No creature without flying will be able to block that turn, including creatures that lose flying after Seismic Stomp resolves and creatures without flying that enter the battlefield after Seismic Stomp resolves.{{}}{{}}Creatures without flying can't block this turn.{{}}152{{}}TRUE
23388{{}}370724{{}}Sengir Vampire{{}}Magic 2014 Core Set{{}}M14{{}}Creature — Vampire{{}}4{{}}4{{}}{{}}{3}{B}{B}{{}}5{{}}Kev Walker{{}}<em>Empires rise and fall, but evil is eternal.</em>{{}}B{{}}{{}}113{{}}U{{}}3.75{{}}|||7/15/2007 : If Sengir Vampire deals nonlethal damage to a creature and then a different effect or damage source causes that creature to be put into a graveyard later in the turn, Sengir Vampire's ability will trigger and it will get a +1/+1 counter. |||9/22/2011 : Each time a creature is put into a graveyard from the battlefield, check whether Sengir Vampire had dealt any damage to it at any time during that turn. If so, Sengir Vampire's ability will trigger. It doesn't matter who controlled the creature or whose graveyard it was put into. |||9/22/2011 : If Sengir Vampire and a creature it dealt damage to are both put into a graveyard at the same time, Sengir Vampire's ability will trigger, but it will do nothing when it resolves.{{}}{{}}Flying|||Whenever a creature dealt damage by Sengir Vampire this turn dies, put a +1/+1 counter on Sengir Vampire.{{}}113{{}}TRUE
23389{{}}370780{{}}Sensory Deprivation{{}}Magic 2014 Core Set{{}}M14{{}}Enchantment — Aura{{}}{{}}{{}}{{}}{U}{{}}1{{}}Steven Belledin{{}}"<em>They call it ""stitcher's anesthesia,"" a spell to deaden the senses while the mad doctors begin their grisly work.</em>"{{}}U{{}}{{}}71{{}}C{{}}2.25{{}}{{}}{{}}Enchant creature|||Enchanted creature gets -3/-0.{{}}71{{}}TRUE
23390{{}}370813{{}}Sentinel Sliver{{}}Magic 2014 Core Set{{}}M14{{}}Creature — Sliver{{}}2{{}}2{{}}{{}}{1}{W}{{}}2{{}}Maciej Kuciara{{}}<em>Through its watchful gaze, all slivers may see.</em>{{}}W{{}}{{}}30{{}}C{{}}3.227{{}}|||7/1/2013 : If you change the creature type of a Sliver you control so it’s no longer a Sliver, it will no longer be affected by its own ability. Its ability will continue to affect other Sliver creatures you control. |||7/1/2013 : Abilities that Slivers grant, as well as power/toughness boosts, are cumulative. However, for some abilities, like flying, having more than one instance of the ability doesn’t provide any additional benefit.{{}}{{}}Sliver creatures you control have vigilance. <em>(Attacking doesn't cause them to tap.)</em>{{}}30{{}}TRUE
23391{{}}370620{{}}Seraph of the Sword{{}}Magic 2014 Core Set{{}}M14{{}}Creature — Angel{{}}3{{}}3{{}}{{}}{3}{W}{{}}4{{}}Jaime Jones{{}}"<em>""Only when my sword lies idle shall I rejoice.""</em>"{{}}W{{}}{{}}31{{}}R{{}}3.886{{}}|||7/1/2013 : If Seraph of the Sword blocks a creature with trample, that creature’s controller must assign 3 damage to Seraph of the Sword (assuming it’s blocking no other creatures, there was no damage marked on it, and nothing has changed its toughness). The remainder can be assigned to the defending player or planeswalker.{{}}{{}}Flying|||Prevent all combat damage that would be dealt to Seraph of the Sword.{{}}31{{}}TRUE
23392{{}}370602{{}}Serra Angel{{}}Magic 2014 Core Set{{}}M14{{}}Creature — Angel{{}}4{{}}4{{}}{{}}{3}{W}{W}{{}}5{{}}Greg Staples{{}}<em>Follow the light. In its absence, follow her.</em>{{}}W{{}}{{}}32{{}}U{{}}4.333{{}}{{}}{{}}Flying|||Vigilance <em>(Attacking doesn't cause this creature to tap.)</em>{{}}32{{}}TRUE
23393{{}}370746{{}}Shadowborn Apostle{{}}Magic 2014 Core Set{{}}M14{{}}Creature — Human Cleric{{}}1{{}}1{{}}{{}}{B}{{}}1{{}}Lucas Graciano{{}}{{}}B{{}}{{}}114{{}}C{{}}3.852{{}}|||7/1/2013 : Shadowborn Apostle’s first ability lets you ignore only the “four-of” rule. It doesn’t let you ignore format legality. |||7/1/2013 : You sacrifice the six creatures when you activate the ability. You can’t respond to that ability by activating the ability of one of the other Shadowborn Apostles you just sacrificed. |||7/1/2013 : You don’t have to sacrifice the Shadowborn Apostle whose ability you activated. It can be six other Shadowborn Apostles.{{}}{{}}A deck can have any number of cards named Shadowborn Apostle.|||{B}, Sacrifice six creatures named Shadowborn Apostle: Search your library for a Demon creature card and put it onto the battlefield. Then shuffle your library.{{}}114{{}}TRUE
