23320{{}}370743{{}}Hunt the Weak{{}}Magic 2014 Core Set{{}}M14{{}}Sorcery{{}}{{}}{{}}{{}}{3}{G}{{}}4{{}}Raoul Vitale{{}}<em>He who hesitates is lunch.</em>{{}}G{{}}{{}}179{{}}C{{}}2.333{{}}|||7/1/2013 : You can’t cast Hunt the Weak unless you choose both a creature you control and a creature you don’t control as targets. |||7/1/2013 : If either target is an illegal target when Hunt the Weak tries to resolve, neither creature will deal or be dealt damage. |||7/1/2013 : If the creature you control is an illegal target when Hunt the Weak tries to resolve, you won’t put a +1/+1 counter on it. If that creature is a legal target but the creature you don’t control isn’t, you’ll still put the counter on the creature you control.{{}}{{}}Put a +1/+1 counter on target creature you control. Then that creature fights target creature you don't control. <em>(Each deals damage equal to its power to the other.)</em>{{}}179{{}}TRUE
23321{{}}370701{{}}Illusionary Armor{{}}Magic 2014 Core Set{{}}M14{{}}Enchantment — Aura{{}}{{}}{{}}{{}}{4}{U}{{}}5{{}}Mathias Kollros{{}}{{}}U{{}}{{}}59{{}}U{{}}1.595{{}}|||7/1/2013 : Only Illusionary Armor is sacrificed because of its triggered ability; the enchanted creature is not.{{}}{{}}Enchant creature|||Enchanted creature gets +4/+4.|||When enchanted creature becomes the target of a spell or ability, sacrifice Illusionary Armor.{{}}59{{}}TRUE
23322{{}}370770{{}}Imposing Sovereign{{}}Magic 2014 Core Set{{}}M14{{}}Creature — Human{{}}2{{}}1{{}}{{}}{1}{W}{{}}2{{}}Scott M. Fischer{{}}<em>Some are born to rule. The rest are born to bow before them.</em>{{}}W{{}}{{}}22{{}}R{{}}4.034{{}}{{}}{{}}Creatures your opponents control enter the battlefield tapped.{{}}22{{}}TRUE
23323{{}}370673{{}}Indestructibility{{}}Magic 2014 Core Set{{}}M14{{}}Enchantment — Aura{{}}{{}}{{}}{{}}{3}{W}{{}}4{{}}Darrell Riche{{}}"<em>""By all means, keep trying.""</em>"{{}}W{{}}{{}}23{{}}R{{}}3.722{{}}"|||10/1/2009 : If an effect would simultaneously destroy Indestructibility and the creature it's enchanting, only Indestructibility is destroyed. |||7/1/2013 : Lethal damage, damage from a source with deathtouch, and effects that say ""destroy"" won't cause a permanent with indestructible to be put into the graveyard. However, a permanent with indestructible can be put into the graveyard for a number of reasons. The most likely reasons are if it's sacrificed, if it's legendary and another legendary permanent with the same name is controlled by the same player, if it's a planeswalker and another planeswalker with the same subtype is controlled by the same player, if it's a creature with toughness 0 or less, or if it's an Aura that's either unattached or attached to something illegal. |||7/1/2013 : If a creature enchanted by Indestructibility is dealt lethal damage, the creature isn't destroyed, but the damage remains marked on the creature. If Indestructibility stops enchanting that creature later in the turn, the creature will no longer have indestructible and will be destroyed."{{}}{{}}"Enchant permanent|||Enchanted permanent has indestructible. <em>(Effects that say ""destroy"" don't destroy that permanent. A creature with indestructible can't be destroyed by damage.)</em>"{{}}23{{}}TRUE
23324{{}}370579{{}}Into the Wilds{{}}Magic 2014 Core Set{{}}M14{{}}Enchantment{{}}{{}}{{}}{{}}{3}{G}{{}}4{{}}Véronique Meignaud{{}}"<em>""Wonders hide where the trees grow thickest.""—Mul Daya proverb</em>"{{}}G{{}}{{}}180{{}}R{{}}4.043{{}}|||7/1/2013 : Putting a land onto the battlefield this way doesn’t count as playing a land. You’ll still be able to play a land during one of your main phases. |||7/1/2013 : If the card is not a land card, or you choose not to put it onto the battlefield, it will stay on top of your library. In most cases, you’ll then draw it during your draw step.{{}}{{}}At the beginning of your upkeep, look at the top card of your library. If it's a land card, you may put it onto the battlefield.{{}}180{{}}TRUE
23325{{}}370611{{}}Island{{}}Magic 2014 Core Set{{}}M14{{}}Basic Land — Island{{}}{{}}{{}}{{}}{{}}0{{}}Jonas De Ro{{}}{{}}L{{}}{U}{{}}236{{}}C{{}}3.278{{}}{{}}2{{}}{U}{{}}236{{}}TRUE
23326{{}}370728{{}}Jace, Memory Adept{{}}Magic 2014 Core Set{{}}M14{{}}Planeswalker — Jace{{}}{{}}{{}}4{{}}{3}{U}{U}{{}}5{{}}D. Alexander Gregory{{}}{{}}U{{}}{{}}60{{}}M{{}}4.028{{}}|||9/22/2011 : If you target yourself with Jace's first ability, you'll draw a card first, then put the top card of your library into your graveyard. |||9/22/2011 : If you activate Jace's first ability, and the player is an illegal target when the ability tries to resolve, it will be countered and none of its effects will happen. You won't draw a card. |||9/22/2011 : If Jace's third ability causes a player to draw more cards than are left in his or her library, that player loses the game as a state-based action. If this ability causes all players to do this, the game is a draw. |||7/1/2013 : Planeswalkers are permanents. You can cast one at the time you could cast a sorcery. When your planeswalker spell resolves, it enters the battlefield under your control. |||7/1/2013 : Planeswalkers are not creatures. Spells and abilities that affect creatures won’t affect them. |||7/1/2013 : Planeswalkers have loyalty. A planeswalker enters the battlefield with a number of loyalty counters on it equal to the number printed in its lower right corner. Activating one of its abilities may cause it to gain or lose loyalty counters. Damage dealt to a planeswalker causes that many loyalty counters to be removed from it. If it has no loyalty counters on it, it’s put into its owner’s graveyard as a state-based action. |||7/1/2013 : Planeswalkers each have a number of activated abilities called “loyalty abilities.” You can activate a loyalty ability of a planeswalker you control only at the time you could cast a sorcery and only if you haven’t activated one of that planeswalker’s loyalty abilities yet that turn. |||7/1/2013 : The cost to activate a planeswalker’s loyalty ability is represented by a symbol with a number inside. Up-arrows contain positive numbers, such as “+1”; this means “Put one loyalty counter on this planeswalker.” Down-arrows contain negative numbers, such as “-7”; this means “Remove seven loyalty counters from this planeswalker.” A symbol with a “0” means “Put zero loyalty counters on this planeswalker.” |||7/1/2013 : You can’t activate a planeswalker’s ability with a negative loyalty cost unless the planeswalker has at least that many loyalty counters on it. |||7/1/2013 : Planeswalkers can’t attack (unless an effect turns the planeswalker into a creature). However, they can be attacked. Each of your attacking creatures can attack your opponent or a planeswalker that player controls. You say which as you declare attackers. |||7/1/2013 : If your planeswalkers are being attacked, you can block the attackers as normal. |||7/1/2013 : If a creature that’s attacking a planeswalker isn’t blocked, it’ll deal its combat damage to that planeswalker. Damage dealt to a planeswalker causes that many loyalty counters to be removed from it. |||7/1/2013 : If a source you control would deal noncombat damage to an opponent, you may have that source deal that damage to a planeswalker that opponent controls instead. For example, although you can’t target a planeswalker with Shock, you can target your opponent with Shock, and then as Shock resolves, choose to have Shock deal its 2 damage to one of your opponent’s planeswalkers. (You can’t split up that damage between different players and/or planeswalkers.) If you have Shock deal its damage to a planeswalker, two loyalty counters are removed from it. |||7/1/2013 : If a player controls two or more planeswalkers that share a planeswalker type, that player chooses one of them and the rest are put into their owners’ graveyards as a state-based action.{{}}{{}}+1: Draw a card. Target player puts the top card of his or her library into his or her graveyard.|||0: Target player puts the top ten cards of his or her library into his or her graveyard.|||-7: Any number of target players each draw twenty cards.{{}}60{{}}TRUE
23327{{}}370638{{}}Jace's Mindseeker{{}}Magic 2014 Core Set{{}}M14{{}}Creature — Fish Illusion{{}}4{{}}4{{}}{{}}{4}{U}{U}{{}}6{{}}Greg Staples{{}}{{}}U{{}}{{}}61{{}}R{{}}3.654{{}}{{}}{{}}Flying|||When Jace's Mindseeker enters the battlefield, target opponent puts the top five cards of his or her library into his or her graveyard. You may cast an instant or sorcery card from among them without paying its mana cost.{{}}61{{}}TRUE
23328{{}}370766{{}}Kalonian Hydra{{}}Magic 2014 Core Set{{}}M14{{}}Creature — Hydra{{}}0{{}}0{{}}{{}}{3}{G}{G}{{}}5{{}}Chris Rahn{{}}<em>Even baloths fear its feeding time.</em>{{}}G{{}}{{}}181{{}}M{{}}4.216{{}}|||7/1/2013 : To double the number of +1/+1 counters on a creature, determine how many +1/+1 counters are on the creature and put that many more on it. Effects that interact with counters (such as the one created by Corpsejack Menace’s ability) may change the number of counters ultimately put on the creature.{{}}{{}}Trample|||Kalonian Hydra enters the battlefield with four +1/+1 counters on it.|||Whenever Kalonian Hydra attacks, double the number of +1/+1 counters on each creature you control.{{}}181{{}}TRUE
23329{{}}370700{{}}Kalonian Tusker{{}}Magic 2014 Core Set{{}}M14{{}}Creature — Beast{{}}3{{}}3{{}}{{}}{G}{G}{{}}2{{}}Svetlin Velinov{{}}"<em>""And all this time I thought we were tracking it.""—Juruk, Kalonian tracker</em>"{{}}G{{}}{{}}182{{}}U{{}}3.729{{}}{{}}{{}}{{}}182{{}}TRUE
23330{{}}370595{{}}Lava Axe{{}}Magic 2014 Core Set{{}}M14{{}}Sorcery{{}}{{}}{{}}{{}}{4}{R}{{}}5{{}}Brian Snoddy{{}}<em>A strict upgrade over the cinder hatchet.</em>{{}}R{{}}{{}}143{{}}C{{}}2.231{{}}{{}}{{}}Lava Axe deals 5 damage to target player.{{}}143{{}}TRUE
23331{{}}370767{{}}Lay of the Land{{}}Magic 2014 Core Set{{}}M14{{}}Sorcery{{}}{{}}{{}}{{}}{G}{{}}1{{}}Chuck Lukacs{{}}<em>Victory favors neither the righteous nor the wicked. It favors the prepared.</em>{{}}G{{}}{{}}183{{}}C{{}}2.196{{}}"|||10/4/2004 : Because the ""search"" requires you to find a card with certain characteristics, you don't have to find the card if you don't want to."{{}}{{}}Search your library for a basic land card, reveal it, put it into your hand, then shuffle your library.{{}}183{{}}TRUE
23332{{}}370723{{}}Lifebane Zombie{{}}Magic 2014 Core Set{{}}M14{{}}Creature — Zombie Warrior{{}}3{{}}1{{}}{{}}{1}{B}{B}{{}}3{{}}Min Yum{{}}{{}}B{{}}{{}}101{{}}R{{}}3.75{{}}{{}}{{}}Intimidate <em>(This creature can't be blocked except by artifact creatures and/or creatures that share a color with it.)</em>|||When Lifebane Zombie enters the battlefield, target opponent reveals his or her hand. You choose a green or white creature card from it and exile that card.{{}}101{{}}TRUE
23333{{}}370795{{}}Lightning Talons{{}}Magic 2014 Core Set{{}}M14{{}}Enchantment — Aura{{}}{{}}{{}}{{}}{2}{R}{{}}3{{}}Johann Bodin{{}}"<em>""The victim was either clawed to death or struck by lightning. Possibly both.""—Pel Javya, Wojek investigator</em>"{{}}R{{}}{{}}144{{}}C{{}}3.375{{}}{{}}{{}}Enchant creature|||Enchanted creature gets +3/+0 and has first strike. <em>(It deals combat damage before creatures without first strike.)</em>{{}}144{{}}TRUE
23334{{}}370658{{}}Liliana of the Dark Realms{{}}Magic 2014 Core Set{{}}M14{{}}Planeswalker — Liliana{{}}{{}}{{}}3{{}}{2}{B}{B}{{}}4{{}}D. Alexander Gregory{{}}{{}}B{{}}{B}{{}}102{{}}M{{}}3.964{{}}|||7/1/2012 : You can activate Liliana's first ability even if your library contains no Swamp cards (or you don't want to find one). You'll still search your library and shuffle it. |||7/1/2012 : When you activate Liliana's second ability, you choose only the target creature. You choose whether that creature gets +X/+X or -X/-X when the ability resolves. The value of X is determined by the number of Swamps you control when the ability resolves. |||7/1/2012 : Liliana's emblem doesn't remove any other abilities of Swamps you control. |||7/1/2013 : Each of Liliana’s abilities refers to lands (or land cards) with the subtype Swamp, not just ones named Swamp. |||7/1/2013 : Planeswalkers are permanents. You can cast one at the time you could cast a sorcery. When your planeswalker spell resolves, it enters the battlefield under your control. |||7/1/2013 : Planeswalkers are not creatures. Spells and abilities that affect creatures won’t affect them. |||7/1/2013 : Planeswalkers have loyalty. A planeswalker enters the battlefield with a number of loyalty counters on it equal to the number printed in its lower right corner. Activating one of its abilities may cause it to gain or lose loyalty counters. Damage dealt to a planeswalker causes that many loyalty counters to be removed from it. If it has no loyalty counters on it, it’s put into its owner’s graveyard as a state-based action. |||7/1/2013 : Planeswalkers each have a number of activated abilities called “loyalty abilities.” You can activate a loyalty ability of a planeswalker you control only at the time you could cast a sorcery and only if you haven’t activated one of that planeswalker’s loyalty abilities yet that turn. |||7/1/2013 : The cost to activate a planeswalker’s loyalty ability is represented by a symbol with a number inside. Up-arrows contain positive numbers, such as “+1”; this means “Put one loyalty counter on this planeswalker.” Down-arrows contain negative numbers, such as “-7”; this means “Remove seven loyalty counters from this planeswalker.” A symbol with a “0” means “Put zero loyalty counters on this planeswalker.” |||7/1/2013 : You can’t activate a planeswalker’s ability with a negative loyalty cost unless the planeswalker has at least that many loyalty counters on it. |||7/1/2013 : Planeswalkers can’t attack (unless an effect turns the planeswalker into a creature). However, they can be attacked. Each of your attacking creatures can attack your opponent or a planeswalker that player controls. You say which as you declare attackers. |||7/1/2013 : If your planeswalkers are being attacked, you can block the attackers as normal. |||7/1/2013 : If a creature that’s attacking a planeswalker isn’t blocked, it’ll deal its combat damage to that planeswalker. Damage dealt to a planeswalker causes that many loyalty counters to be removed from it. |||7/1/2013 : If a source you control would deal noncombat damage to an opponent, you may have that source deal that damage to a planeswalker that opponent controls instead. For example, although you can’t target a planeswalker with Shock, you can target your opponent with Shock, and then as Shock resolves, choose to have Shock deal its 2 damage to one of your opponent’s planeswalkers. (You can’t split up that damage between different players and/or planeswalkers.) If you have Shock deal its damage to a planeswalker, two loyalty counters are removed from it. |||7/1/2013 : If a player controls two or more planeswalkers that share a planeswalker type, that player chooses one of them and the rest are put into their owners’ graveyards as a state-based action.{{}}{{}}"+1: Search your library for a Swamp card, reveal it, and put it into your hand. Then shuffle your library.|||-3: Target creature gets +X/+X or -X/-X until end of turn, where X is the number of Swamps you control.|||-6: You get an emblem with ""Swamps you contr"{{}}102{{}}TRUE
23335{{}}370740{{}}Liliana's Reaver{{}}Magic 2014 Core Set{{}}M14{{}}Creature — Zombie{{}}4{{}}3{{}}{{}}{2}{B}{B}{{}}4{{}}Karl Kopinski{{}}{{}}B{{}}{{}}103{{}}R{{}}4.188{{}}{{}}{{}}Deathtouch <em>(Any amount of damage this deals to a creature is enough to destroy it.)</em>|||Whenever Liliana's Reaver deals combat damage to a player, that player discards a card and you put a 2/2 black Zombie creature token onto the battlefield tapped.{{}}103{{}}TRUE
23336{{}}370652{{}}Liturgy of Blood{{}}Magic 2014 Core Set{{}}M14{{}}Sorcery{{}}{{}}{{}}{{}}{3}{B}{B}{{}}5{{}}Zack Stella{{}}"<em>""You harbor such vast potential. It would be such a shame to let you die of old age.""—Zul Ashur, lich lord</em>"{{}}B{{}}{B}{{}}104{{}}C{{}}3.105{{}}|||7/1/2013 : Liturgy of Blood isn’t a mana ability and uses the stack. Players can respond to it by casting spells and activating abilities. |||7/1/2013 : If the target creature is an illegal target when Liturgy of Blood tries to resolve, it will be countered and none of its effects will happen. You won’t add mana to your mana pool.{{}}{{}}Destroy target creature. Add {B}{B}{B} to your mana pool.{{}}104{{}}TRUE
23337{{}}370599{{}}Manaweft Sliver{{}}Magic 2014 Core Set{{}}M14{{}}Creature — Sliver{{}}1{{}}1{{}}{{}}{1}{G}{{}}2{{}}Trevor Claxton{{}}"<em>""I see in their interconnectedness a strange embodiment of the natural order.""—Dionus, elvish archdruid</em>"{{}}G{{}}{W}{U}{B}{R}{G}{{}}184{{}}U{{}}3.629{{}}|||7/1/2013 : If you change the creature type of a Sliver you control so it’s no longer a Sliver, it will no longer be affected by its own ability. Its ability will continue to affect other Sliver creatures you control. |||7/1/2013 : Abilities that Slivers grant, as well as power/toughness boosts, are cumulative. However, for some abilities, like flying, having more than one instance of the ability doesn’t provide any additional benefit.{{}}{{}}"Sliver creatures you control have ""{T}: Add one mana of any color to your mana pool."""{{}}184{{}}TRUE
23338{{}}370648{{}}Marauding Maulhorn{{}}Magic 2014 Core Set{{}}M14{{}}Creature — Beast{{}}5{{}}3{{}}{{}}{2}{R}{R}{{}}4{{}}Jesper Ejsing{{}}"<em>""It's not just you. Everyone makes it angry.""—Ardenoth, elvish nature advocate</em>"{{}}R{{}}{{}}145{{}}C{{}}3.2{{}}|||7/1/2013 : Marauding Maulhorn can attack if you control a creature named Advocate of the Beast. It just isn’t forced to. |||7/1/2013 : Marauding Maulhorn checks whether you control a creature named Advocate of the Beast as attacking creatures are declared. At that time, if you don’t, Marauding Maulhorn attacks if able. |||7/1/2013 : If, during your declare attackers step, Marauding Maulhorn is tapped, is affected by a spell or ability that says it can’t attack, or hasn’t been under your control continuously since the turn began (and doesn’t have haste), then it doesn’t attack. If there’s a cost associated with having Marauding Maulhorn attack, you aren’t forced to pay that cost, so it doesn’t have to attack in that case either.{{}}{{}}Marauding Maulhorn attacks each combat if able unless you control a creature named Advocate of the Beast.{{}}145{{}}TRUE
23339{{}}370787{{}}Mark of the Vampire{{}}Magic 2014 Core Set{{}}M14{{}}Enchantment — Aura{{}}{{}}{{}}{{}}{3}{B}{{}}4{{}}Winona Nelson{{}}"<em>""My ‘condition' is a trial. The weak are consumed by it. The strong transcend it.""—Sorin Markov</em>"{{}}B{{}}{{}}105{{}}C{{}}3.318{{}}|||7/1/2012 : Multiple instances of lifelink are redundant. If Mark of the Vampire enchants a creature that already has lifelink, damage that creature deals won't cause you to gain additional life.{{}}{{}}Enchant creature|||Enchanted creature gets +2/+2 and has lifelink. <em>(Damage dealt by the creature also causes its controller to gain that much life.)</em>{{}}105{{}}TRUE
23340{{}}370708{{}}Master of Diversion{{}}Magic 2014 Core Set{{}}M14{{}}Creature — Human Scout{{}}2{{}}2{{}}{{}}{2}{W}{{}}3{{}}Michael Komarck{{}}<em>Choose your battles carefully. For example, avoid the big guy.</em>{{}}W{{}}{{}}24{{}}C{{}}3.833{{}}|||7/1/2013 : The ability will resolve and the creature will become tapped before blocking creatures are declared. |||7/1/2013 : In a Two-Headed Giant game, any creature controlled by a member of the defending team can be chosen as the target. |||7/1/2013 : In other multiplayer formats, including Commander, only a creature controlled by the defending player Master of Diversion is attacking can be chosen as the target, even if your other attacking creatures are attacking different players.{{}}{{}}Whenever Master of Diversion attacks, tap target creature defending player controls.{{}}24{{}}TRUE
23341{{}}370794{{}}Megantic Sliver{{}}Magic 2014 Core Set{{}}M14{{}}Creature — Sliver{{}}3{{}}3{{}}{{}}{5}{G}{{}}6{{}}Ryan Barger{{}}<em>Even the thrums, the lowliest of slivers, become deadly in its presence.</em>{{}}G{{}}{{}}185{{}}R{{}}3.259{{}}|||7/1/2013 : If you change the creature type of a Sliver you control so it’s no longer a Sliver, it will no longer be affected by its own ability. Its ability will continue to affect other Sliver creatures you control. |||7/1/2013 : Abilities that Slivers grant, as well as power/toughness boosts, are cumulative. However, for some abilities, like flying, having more than one instance of the ability doesn’t provide any additional benefit.{{}}{{}}Sliver creatures you control get +3/+3.{{}}185{{}}TRUE
23342{{}}370762{{}}Merfolk Spy{{}}Magic 2014 Core Set{{}}M14{{}}Creature — Merfolk Rogue{{}}1{{}}1{{}}{{}}{U}{{}}1{{}}Matt Cavotta & Richard Whitters{{}}{{}}U{{}}{{}}62{{}}C{{}}3.222{{}}|||8/15/2010 : Islandwalk cares about lands with the land type Island, not necessarily lands named Island. |||8/15/2010 : The second ability triggers just once each time Merfolk Spy deals combat damage to a player, regardless of how much damage it deals. |||8/15/2010 : After the second ability resolves, the revealed card stops being revealed in its owner's hand. |||8/15/2010 : The next time Merfolk Spy deals combat damage to the same player, the card that's revealed at random may be the same card or may be a different card.{{}}{{}}Islandwalk <em>(This creature can't be blocked as long as defending player controls an Island.)</em>|||Whenever Merfolk Spy deals combat damage to a player, that player reveals a card at random from his or her hand.{{}}62{{}}TRUE
23343{{}}370807{{}}Messenger Drake{{}}Magic 2014 Core Set{{}}M14{{}}Creature — Drake{{}}3{{}}3{{}}{{}}{3}{U}{U}{{}}5{{}}Yeong-Hao Han{{}}<em>The more important the message, the larger the messenger.</em>{{}}U{{}}{{}}63{{}}C{{}}2.654{{}}{{}}{{}}Flying|||When Messenger Drake dies, draw a card.{{}}63{{}}TRUE
23344{{}}370737{{}}Millstone{{}}Magic 2014 Core Set{{}}M14{{}}Artifact{{}}{{}}{{}}{{}}{2}{{}}2{{}}Yeong-Hao Han{{}}<em>Minds, like mountains, are never so grand and mighty that they can't be reduced to dust.</em>{{}}A{{}}{{}}213{{}}U{{}}3.667{{}}|||10/4/2004 : Can be used on a player with less than 2 cards in their library. It will remove 0 or 1 cards if that is all that is available.  |||10/4/2004 : It is not a draw effect so it will not cause a player with less than 2 cards in their library to lose.  |||10/4/2004 : Since you are putting more than one card in the graveyard at one time, the affected player can choose the order the 2 cards go in.{{}}{{}}{2}, {T}: Target player puts the top two cards of his or her library into his or her graveyard.{{}}213{{}}TRUE
23345{{}}370711{{}}Mind Rot{{}}Magic 2014 Core Set{{}}M14{{}}Sorcery{{}}{{}}{{}}{{}}{2}{B}{{}}3{{}}Steve Luke{{}}"<em>""What a pity. You should have written it down.""—Liliana Vess</em>"{{}}B{{}}{{}}106{{}}C{{}}2.769{{}}{{}}{{}}Target player discards two cards.{{}}106{{}}TRUE
23346{{}}370695{{}}Mindsparker{{}}Magic 2014 Core Set{{}}M14{{}}Creature — Elemental{{}}3{{}}2{{}}{{}}{1}{R}{R}{{}}3{{}}Wayne Reynolds{{}}{{}}R{{}}{{}}146{{}}R{{}}4.043{{}}|||7/1/2013 : Mindsparker’s ability will trigger whenever an opponent casts an instant or sorcery spell that’s white, blue, or both. If the spell is both white and blue, Mindsparker’s ability will trigger only once. |||7/1/2013 : If an opponent casts a copy of a white or blue instant or sorcery card (as opposed to putting a copy of such a spell directly on the stack), the ability will trigger.{{}}{{}}First strike <em>(This creature deals combat damage before creatures without first strike.)</em>|||Whenever an opponent casts a white or blue instant or sorcery spell, Mindsparker deals 2 damage to that player.{{}}146{{}}TRUE
23347{{}}370683{{}}Minotaur Abomination{{}}Magic 2014 Core Set{{}}M14{{}}Creature — Zombie Minotaur{{}}4{{}}6{{}}{{}}{4}{B}{B}{{}}6{{}}Karl Kopinski{{}}"<em>""Look at that. Shuffling, wobbling, entrails placed haphazardly. It's shameful. Who would let that kind of work flap about for all to see?""—Lestin, necromancer</em>"{{}}B{{}}{{}}107{{}}C{{}}2.174{{}}{{}}{{}}{{}}107{{}}TRUE
23348{{}}370604{{}}Molten Birth{{}}Magic 2014 Core Set{{}}M14{{}}Sorcery{{}}{{}}{{}}{{}}{1}{R}{R}{{}}3{{}}Jaime Jones{{}}"<em>""Few can coax the creatures within the magma to be cooled and take form.""—Koth of the Hammer</em>"{{}}R{{}}{{}}147{{}}U{{}}3.5{{}}|||7/1/2013 : If you win the flip, Molten Birth goes directly from the stack to its owner’s hand. It never goes to a graveyard.{{}}{{}}Put two 1/1 red Elemental creature tokens onto the battlefield. Then flip a coin. If you win the flip, return Molten Birth to its owner's hand.{{}}147{{}}TRUE
23349{{}}370588{{}}Mountain{{}}Magic 2014 Core Set{{}}M14{{}}Basic Land — Mountain{{}}{{}}{{}}{{}}{{}}0{{}}Cliff Childs{{}}{{}}L{{}}{R}{{}}242{{}}C{{}}3.375{{}}{{}}2{{}}{R}{{}}242{{}}TRUE
