23288{{}}370747{{}}Elite Arcanist{{}}Magic 2014 Core Set{{}}M14{{}}Creature — Human Wizard{{}}1{{}}1{{}}{{}}{3}{U}{{}}4{{}}James Zapata{{}}{{}}U{{}}{{}}54{{}}R{{}}3.81{{}}|||7/1/2013 : You don’t choose the value of {X} in the activation cost of Elite Arcanist’s ability. It’s defined by the converted mana cost of the exiled instant card. |||7/1/2013 : The copy is created in and cast from exile. You must still follow any timing restrictions, such as “Cast [this spell] only during combat.” |||7/1/2013 : You can’t pay any alternative costs such as overload costs. You can pay additional costs such as kicker costs. If the spell has any mandatory additional costs, you must pay those. |||7/1/2013 : If the copied card has {X} in its mana cost, you must choose 0 as its value when casting the copy. Don’t confuse that {X} with the {X} in the activation cost of Elite Arcanist’s ability. |||7/1/2013 : If the exiled card is a split card, then {X} is the sum of the converted mana costs of each half. However, when you cast the copy, you choose only one half to cast. You may cast a different half each time you create and cast a copy. |||7/1/2013 : If Elite Arcanist leaves the battlefield, you will no longer be able to copy the exiled card. If it returns to the battlefield, you’ll be able to exile another instant card from your hand, but Elite Arcanist will be a different permanent with no connection to the first exiled card.{{}}{{}}When Elite Arcanist enters the battlefield, you may exile an instant card from your hand.|||{X}, {T}: Copy the exiled card. You may cast the copy without paying its mana cost. X is the converted mana cost of the exiled card.{{}}54{{}}TRUE
23289{{}}370681{{}}Elixir of Immortality{{}}Magic 2014 Core Set{{}}M14{{}}Artifact{{}}{{}}{{}}{{}}{1}{{}}1{{}}Zoltan Boros & Gabor Szikszai{{}}"<em>""Bottled life. Not as tasty as I'm used to, rather stale, but it has the same effect.""—Baron Sengir</em>"{{}}A{{}}{{}}209{{}}U{{}}4.083{{}}|||8/15/2010 : Paying the activation cost of Elixir of Immortality's ability doesn't cause it to leave the battlefield. If you have a way to untap it, you can activate the ability multiple times in response to itself. |||9/22/2011 : As the ability resolves, you'll shuffle Elixir of Immortality into its owner's library directly from the battlefield, if it's still there. |||9/22/2011 : If Elixir of Immortality is in your graveyard at the time the ability resolves, you'll still wind up shuffling it into your library because you shuffle your entire graveyard into your library. If it's anywhere else by that time, including in another player's graveyard, it remains where it is and you shuffle just your graveyard into your library. |||9/22/2011 : If you gain control of another player's Elixir of Immortality and activate it, the Elixir of Immortality will be shuffled into its owner's library and the cards in your graveyard will be shuffled into your library. You are considered to have shuffled each affected library (even if, as a shortcut, each player physically shuffles his or her own library).{{}}{{}}{2}, {T}: You gain 5 life. Shuffle Elixir of Immortality and your graveyard into their owner's library.{{}}209{{}}TRUE
23290{{}}370744{{}}Elvish Mystic{{}}Magic 2014 Core Set{{}}M14{{}}Creature — Elf Druid{{}}1{{}}1{{}}{{}}{G}{{}}1{{}}Wesley Burt{{}}"<em>""Life grows everywhere. My kin merely find those places where it grows strongest.""—Nissa Revane</em>"{{}}G{{}}{G}{{}}169{{}}C{{}}4.383{{}}{{}}{{}}{T}: Add {G} to your mana pool.{{}}169{{}}TRUE
23291{{}}370769{{}}Encroaching Wastes{{}}Magic 2014 Core Set{{}}M14{{}}Land{{}}{{}}{{}}{{}}{{}}0{{}}Noah Bradley{{}}<em>Every world is a work in progress, constantly reshaped by time, disasters, and even the powerful magic of Planeswalkers.</em>{{}}L{{}}{X}{{}}227{{}}U{{}}2.864{{}}{{}}{{}}{T}: Add {1} to your mana pool.|||{4}, {T}, Sacrifice Encroaching Wastes: Destroy target nonbasic land.{{}}227{{}}TRUE
23292{{}}370797{{}}Enlarge{{}}Magic 2014 Core Set{{}}M14{{}}Sorcery{{}}{{}}{{}}{{}}{3}{G}{G}{{}}5{{}}Michael Komarck{{}}{{}}G{{}}{{}}170{{}}U{{}}3.982{{}}|||7/1/2013 : If the creature attacks, the defending player must assign at least one blocker to it during the declare blockers step if that player controls any creatures that could block it.{{}}{{}}Target creature gets +7/+7 and gains trample until end of turn. It must be blocked this turn if able. <em>(If a creature with trample would assign enough damage to its blockers to destroy them, you may have it assign the rest of its damage to defending player or planeswalker.)</em>{{}}170{{}}TRUE
23293{{}}370694{{}}Essence Scatter{{}}Magic 2014 Core Set{{}}M14{{}}Instant{{}}{{}}{{}}{{}}{1}{U}{{}}2{{}}Jon Foster{{}}"<em>""What you attempt to pull from the Æther, I can spread onto the wind.""—Jace Beleren</em>"{{}}U{{}}{{}}55{{}}C{{}}3.962{{}}"|||10/1/2009 : A ""creature spell"" is any spell with the type Creature, even if it has other types such as Artifact or Enchantment. Older cards of type Summon are also Creature spells."{{}}{{}}Counter target creature spell.{{}}55{{}}TRUE
23294{{}}370772{{}}Festering Newt{{}}Magic 2014 Core Set{{}}M14{{}}Creature — Salamander{{}}1{{}}1{{}}{{}}{B}{{}}1{{}}Eric Deschamps{{}}<em>Its back bubbles like a witch's cauldron, and it smells just as vile.</em>{{}}B{{}}{{}}98{{}}C{{}}3.848{{}}|||7/1/2013 : Whether you control a creature named Bogbrew Witch is checked only as the triggered ability resolves.{{}}{{}}When Festering Newt dies, target creature an opponent controls gets -1/-1 until end of turn. That creature gets -4/-4 instead if you control a creature named Bogbrew Witch.{{}}98{{}}TRUE
23295{{}}370786{{}}Fiendslayer Paladin{{}}Magic 2014 Core Set{{}}M14{{}}Creature — Human Knight{{}}2{{}}2{{}}{{}}{1}{W}{W}{{}}3{{}}Wesley Burt{{}}{{}}W{{}}{{}}18{{}}R{{}}4.083{{}}|||7/1/2013 : Fiendslayer Paladin can be affected by black or red spells that don’t target it. For example, a red spell that “deals 3 damage to each creature” would deal damage to Fiendslayer Paladin.{{}}{{}}First strike <em>(This creature deals combat damage before creatures without first strike.)</em> |||Lifelink <em>(Damage dealt by this creature also causes you to gain that much life.)</em>|||Fiendslayer Paladin can't be the target of black or red spells your opponents control.{{}}18{{}}TRUE
23296{{}}370715{{}}Fireshrieker{{}}Magic 2014 Core Set{{}}M14{{}}Artifact — Equipment{{}}{{}}{{}}{{}}{3}{{}}3{{}}Christopher Moeller{{}}{{}}A{{}}{{}}210{{}}U{{}}4.278{{}}{{}}{{}}Equipped creature has double strike. <em>(It deals both first-strike and regular combat damage.)</em>|||Equip {2} <em>({2}: Attach to target creature you control. Equip only as a sorcery.)</em>{{}}210{{}}TRUE
23297{{}}370824{{}}Flames of the Firebrand{{}}Magic 2014 Core Set{{}}M14{{}}Sorcery{{}}{{}}{{}}{{}}{2}{R}{{}}3{{}}Steve Argyle{{}}"<em>""You're in luck. I brought enough to share.""—Chandra Nalaar</em>"{{}}R{{}}{{}}139{{}}U{{}}3.786{{}}|||7/1/2012 : You divide the damage as you cast Flames of the Firebrand, not as it resolves. Each target must be assigned at least 1 damage. (In other words, as you put the spell on the stack, you choose whether to have it deal 3 damage to a single target, 2 damage to one target and 1 damage to another target, or 1 damage to each of three targets.) |||7/1/2012 : You can't deal damage to both a player and a planeswalker controlled by that player with Flames of the Firebrand.{{}}{{}}Flames of the Firebrand deals 3 damage divided as you choose among one, two, or three target creatures and/or players.{{}}139{{}}TRUE
23298{{}}370741{{}}Fleshpulper Giant{{}}Magic 2014 Core Set{{}}M14{{}}Creature — Giant{{}}4{{}}4{{}}{{}}{5}{R}{R}{{}}7{{}}Alex Horley-Orlandelli{{}}<em>He doesn't hate small folk. He just likes the squishing sound they make.</em>{{}}R{{}}{{}}140{{}}U{{}}1.656{{}}|||7/1/2013 : If there are no legal targets available, the ability is simply removed from the stack. If you control the only creature with toughness 2 or less, you must choose it as the target, though you can choose to not destroy it. |||7/1/2013 : If the target creature’s toughness is greater than 2 when the ability tries to resolve, the ability will be countered and the creature won’t be destroyed.{{}}{{}}When Fleshpulper Giant enters the battlefield, you may destroy target creature with toughness 2 or less.{{}}140{{}}TRUE
23299{{}}370633{{}}Fog{{}}Magic 2014 Core Set{{}}M14{{}}Instant{{}}{{}}{{}}{{}}{G}{{}}1{{}}Jaime Jones{{}}"<em>""I fear no army or beast, but only the morning fog. Our assault can survive everything else.""—Lord Hilneth</em>"{{}}G{{}}{{}}171{{}}C{{}}3.923{{}}|||10/1/2009 : Fog has no effect on damage that's already been dealt.{{}}{{}}Prevent all combat damage that would be dealt this turn.{{}}171{{}}TRUE
23300{{}}370729{{}}Forest{{}}Magic 2014 Core Set{{}}M14{{}}Basic Land — Forest{{}}{{}}{{}}{{}}{{}}0{{}}Steven Belledin{{}}{{}}L{{}}{G}{{}}247{{}}C{{}}3{{}}{{}}2{{}}{G}{{}}247{{}}TRUE
23301{{}}370712{{}}Fortify{{}}Magic 2014 Core Set{{}}M14{{}}Instant{{}}{{}}{{}}{{}}{2}{W}{{}}3{{}}Christopher Moeller{{}}"<em>""Where metal is tainted and wood is scarce, we are best armed by faith.""—Tavalus, acolyte of Korlis</em>"{{}}W{{}}{{}}19{{}}C{{}}3.1{{}}|||7/1/2013 : You choose the mode as you cast Fortify, not as it resolves. |||7/1/2013 : Creatures that come under your control after Fortify resolves won’t get the chosen bonus.{{}}{{}}Choose one — Creatures you control get +2/+0 until end of turn; or creatures you control get +0/+2 until end of turn.{{}}19{{}}TRUE
23302{{}}370678{{}}Frost Breath{{}}Magic 2014 Core Set{{}}M14{{}}Instant{{}}{{}}{{}}{{}}{2}{U}{{}}3{{}}Mike Bierek{{}}"<em>""I'll make ice chimes of your bones.""</em>"{{}}U{{}}{{}}56{{}}C{{}}3.577{{}}|||9/22/2011 : If a creature affected by Frost Breath changes controllers before its old controller's next untap step, Frost Breath will prevent it from becoming untapped during its new controller's next untap step. |||4/15/2013 : This spell can target tapped creatures. If a targeted creature is already tapped when the spell resolves, that creature just remains tapped and doesn't untap during its controller's next untap step.{{}}{{}}Tap up to two target creatures. Those creatures don't untap during their controller's next untap step.{{}}56{{}}TRUE
23303{{}}370590{{}}Galerider Sliver{{}}Magic 2014 Core Set{{}}M14{{}}Creature — Sliver{{}}1{{}}1{{}}{{}}{U}{{}}1{{}}James Zapata{{}}<em>Masters of adaptation, galeriders serve multiple purposes useful to the hive. When they're not patrolling their territories, their majestic wings serve to circulate cool air through the vast hive chambers.</em>{{}}U{{}}{{}}57{{}}R{{}}3.685{{}}|||7/1/2013 : If you change the creature type of a Sliver you control so it’s no longer a Sliver, it will no longer be affected by its own ability. Its ability will continue to affect other Sliver creatures you control. |||7/1/2013 : Abilities that Slivers grant, as well as power/toughness boosts, are cumulative. However, for some abilities, like flying, having more than one instance of the ability doesn’t provide any additional benefit.{{}}{{}}Sliver creatures you control have flying.{{}}57{{}}TRUE
23304{{}}370687{{}}Garruk, Caller of Beasts{{}}Magic 2014 Core Set{{}}M14{{}}Planeswalker — Garruk{{}}{{}}{{}}4{{}}{4}{G}{G}{{}}6{{}}Karl Kopinski{{}}{{}}G{{}}{{}}172{{}}M{{}}3.955{{}}|||7/1/2013 : You choose what green creature card to put onto the battlefield, if any, when the second ability resolves. |||7/1/2013 : If you have Garruk’s emblem, the creature card you search for will be put onto the battlefield before the creature spell you cast resolves. The creature card you put onto the battlefield isn’t cast, so the ability of the emblem won’t retrigger. |||7/1/2013 : Planeswalkers are permanents. You can cast one at the time you could cast a sorcery. When your planeswalker spell resolves, it enters the battlefield under your control. |||7/1/2013 : Planeswalkers are not creatures. Spells and abilities that affect creatures won’t affect them. |||7/1/2013 : Planeswalkers have loyalty. A planeswalker enters the battlefield with a number of loyalty counters on it equal to the number printed in its lower right corner. Activating one of its abilities may cause it to gain or lose loyalty counters. Damage dealt to a planeswalker causes that many loyalty counters to be removed from it. If it has no loyalty counters on it, it’s put into its owner’s graveyard as a state-based action. |||7/1/2013 : Planeswalkers each have a number of activated abilities called “loyalty abilities.” You can activate a loyalty ability of a planeswalker you control only at the time you could cast a sorcery and only if you haven’t activated one of that planeswalker’s loyalty abilities yet that turn. |||7/1/2013 : The cost to activate a planeswalker’s loyalty ability is represented by a symbol with a number inside. Up-arrows contain positive numbers, such as “+1”; this means “Put one loyalty counter on this planeswalker.” Down-arrows contain negative numbers, such as “-7”; this means “Remove seven loyalty counters from this planeswalker.” A symbol with a “0” means “Put zero loyalty counters on this planeswalker.” |||7/1/2013 : You can’t activate a planeswalker’s ability with a negative loyalty cost unless the planeswalker has at least that many loyalty counters on it. |||7/1/2013 : Planeswalkers can’t attack (unless an effect turns the planeswalker into a creature). However, they can be attacked. Each of your attacking creatures can attack your opponent or a planeswalker that player controls. You say which as you declare attackers. |||7/1/2013 : If your planeswalkers are being attacked, you can block the attackers as normal. |||7/1/2013 : If a creature that’s attacking a planeswalker isn’t blocked, it’ll deal its combat damage to that planeswalker. Damage dealt to a planeswalker causes that many loyalty counters to be removed from it. |||7/1/2013 : If a source you control would deal noncombat damage to an opponent, you may have that source deal that damage to a planeswalker that opponent controls instead. For example, although you can’t target a planeswalker with Shock, you can target your opponent with Shock, and then as Shock resolves, choose to have Shock deal its 2 damage to one of your opponent’s planeswalkers. (You can’t split up that damage between different players and/or planeswalkers.) If you have Shock deal its damage to a planeswalker, two loyalty counters are removed from it. |||7/1/2013 : If a player controls two or more planeswalkers that share a planeswalker type, that player chooses one of them and the rest are put into their owners’ graveyards as a state-based action.{{}}{{}}+1: Reveal the top five cards of your library. Put all creature cards revealed this way into your hand and the rest on the bottom of your library in any order.|||-3: You may put a green creature card from your hand onto the battlefield.|||-7: You get an emble{{}}172{{}}TRUE
23305{{}}370684{{}}Garruk's Horde{{}}Magic 2014 Core Set{{}}M14{{}}Creature — Beast{{}}7{{}}7{{}}{{}}{5}{G}{G}{{}}7{{}}Steve Prescott{{}}{{}}G{{}}{{}}173{{}}R{{}}3.921{{}}|||9/22/2011 : Normally, Garruk's Horde allows you to cast the top card of your library if it's a creature card, it's your main phase, and the stack is empty. If that creature card has flash, you'll be able to cast it at the time you could cast an instant, even on an opponent's turn. |||9/22/2011 : You'll still pay all costs for that spell, including additional costs. You may also pay alternative costs. |||9/22/2011 : If the top card of your library is Dryad Arbor (the only card that's both a creature and a land), you can't play it this way. Dryad Arbor can't be cast as a spell. |||4/15/2013 : The top card of your library isn't in your hand, so you can't suspend it, cycle it, discard it, or activate any of its activated abilities. |||4/15/2013 : If the top card of your library changes while you're casting a spell or activating an ability, the new top card won't be revealed until you finish casting that spell or activating that ability. |||4/15/2013 : When playing with the top card of your library revealed, if an effect tells you to draw several cards, reveal each one before you draw it.{{}}{{}}Trample|||Play with the top card of your library revealed.|||You may cast the top card of your library if it's a creature card. <em>(Do this only any time you could cast that creature card. You still pay the spell's costs.)</em>{{}}173{{}}TRUE
23306{{}}370788{{}}Giant Growth{{}}Magic 2014 Core Set{{}}M14{{}}Instant{{}}{{}}{{}}{{}}{G}{{}}1{{}}Matt Cavotta{{}}{{}}G{{}}{{}}174{{}}C{{}}4.1{{}}{{}}{{}}Target creature gets +3/+3 until end of turn.{{}}174{{}}TRUE
23307{{}}370781{{}}Giant Spider{{}}Magic 2014 Core Set{{}}M14{{}}Creature — Spider{{}}2{{}}4{{}}{{}}{3}{G}{{}}4{{}}Randy Gallegos{{}}"<em>""It has a quickness about it that seems unnatural for its large size, yet its hunger is about right.""—Endril, Kalonian naturalist</em>"{{}}G{{}}{{}}175{{}}C{{}}3.182{{}}|||4/1/2008 : This card now uses the Reach keyword ability to enable the blocking of flying creatures. This works because a creature with flying can only be blocked by creatures with flying or reach.{{}}{{}}Reach <em>(This creature can block creatures with flying.)</em>{{}}175{{}}TRUE
23308{{}}370716{{}}Gladecover Scout{{}}Magic 2014 Core Set{{}}M14{{}}Creature — Elf Scout{{}}1{{}}1{{}}{{}}{G}{{}}1{{}}Allen Williams{{}}"<em>""The forest is my cover and I hold it close. In such a tight embrace, there is no room for wickedness.""</em>"{{}}G{{}}{{}}176{{}}C{{}}3.308{{}}{{}}{{}}Hexproof <em>(This creature can't be the target of spells or abilities your opponents control.)</em>{{}}176{{}}TRUE
23309{{}}370774{{}}Glimpse the Future{{}}Magic 2014 Core Set{{}}M14{{}}Sorcery{{}}{{}}{{}}{{}}{2}{U}{{}}3{{}}Andrew Robinson{{}}"<em>""No simple coin toss can solve this riddle. You must think and choose wisely.""—Shai Fusan, archmage</em>"{{}}U{{}}{{}}58{{}}U{{}}1.083{{}}{{}}{{}}Look at the top three cards of your library. Put one of them into your hand and the rest into your graveyard.{{}}58{{}}TRUE
23310{{}}370682{{}}Gnawing Zombie{{}}Magic 2014 Core Set{{}}M14{{}}Creature — Zombie{{}}1{{}}3{{}}{{}}{1}{B}{{}}2{{}}Greg Staples{{}}<em>On still nights you can hear its rotted teeth grinding tirelessly on scavenged bones.</em>{{}}B{{}}{{}}99{{}}U{{}}2.958{{}}{{}}{{}}{1}{B}, Sacrifice a creature: Target player loses 1 life and you gain 1 life.{{}}99{{}}TRUE
23311{{}}370674{{}}Goblin Diplomats{{}}Magic 2014 Core Set{{}}M14{{}}Creature — Goblin{{}}2{{}}1{{}}{{}}{1}{R}{{}}2{{}}Izzy{{}}<em>When you need to convey that special kind of message.</em>{{}}R{{}}{{}}141{{}}R{{}}4.207{{}}|||7/1/2013 : The controller of each creature still decides which player or planeswalker that creature attacks. |||7/1/2013 : Creatures that enter the battlefield (or noncreature permanents that become creatures) after the ability resolves are affected by the ability and must attack if able. |||7/1/2013 : If, during a player’s declare attackers step, a creature is tapped, is affected by a spell or ability that says it can’t attack, or hasn’t been under that player’s control continuously since the turn began (and doesn’t have haste), then it doesn’t attack. If there’s a cost associated with having a creature attack, the player isn’t forced to pay that cost, so it doesn’t have to attack in that case either.{{}}{{}}{T}: Each creature attacks this turn if able.{{}}141{{}}TRUE
23312{{}}370610{{}}Goblin Shortcutter{{}}Magic 2014 Core Set{{}}M14{{}}Creature — Goblin Scout{{}}2{{}}1{{}}{{}}{1}{R}{{}}2{{}}Jesper Ejsing{{}}"<em>""I'm not running away! I'm figuring out the best routes.""</em>"{{}}R{{}}{{}}142{{}}C{{}}3.708{{}}{{}}{{}}When Goblin Shortcutter enters the battlefield, target creature can't block this turn.{{}}142{{}}TRUE
23313{{}}370792{{}}Griffin Sentinel{{}}Magic 2014 Core Set{{}}M14{{}}Creature — Griffin{{}}1{{}}3{{}}{{}}{2}{W}{{}}3{{}}Warren Mahy{{}}<em>Once a griffin sentinel adopts a territory as its own, only death can force it to betray its post.</em>{{}}W{{}}{{}}20{{}}C{{}}3.607{{}}{{}}{{}}Flying|||Vigilance <em>(Attacking doesn't cause this creature to tap.)</em>{{}}20{{}}TRUE
23314{{}}370776{{}}Grim Return{{}}Magic 2014 Core Set{{}}M14{{}}Instant{{}}{{}}{{}}{{}}{2}{B}{{}}3{{}}Seb McKinnon{{}}<em>The necromancer's touch strips away memory and loyalty, and only strength and malice remain.</em>{{}}B{{}}{{}}100{{}}R{{}}3.79{{}}|||7/1/2013 : You can choose a creature card in any player’s graveyard as long as that card was put there from the battlefield during the turn. A creature card that was put into a graveyard from anywhere else, such as a card that was discarded, can’t be chosen as the target. |||7/1/2013 : Creature spells that are countered never entered the battlefield, so those cards can’t be chosen as the target of Grim Return.{{}}{{}}Choose target creature card in a graveyard that was put there from the battlefield this turn. Put that card onto the battlefield under your control.{{}}100{{}}TRUE
23315{{}}370626{{}}Groundshaker Sliver{{}}Magic 2014 Core Set{{}}M14{{}}Creature — Sliver{{}}5{{}}5{{}}{{}}{6}{G}{{}}7{{}}Chase Stone{{}}{{}}G{{}}{{}}177{{}}C{{}}2.031{{}}|||7/1/2013 : If you change the creature type of a Sliver you control so it’s no longer a Sliver, it will no longer be affected by its own ability. Its ability will continue to affect other Sliver creatures you control. |||7/1/2013 : Abilities that Slivers grant, as well as power/toughness boosts, are cumulative. However, for some abilities, like flying, having more than one instance of the ability doesn’t provide any additional benefit.{{}}{{}}Sliver creatures you control have trample. <em>(If a Sliver you control would assign enough damage to its blockers to destroy them, you may have it assign the rest of its damage to defending player or planeswalker.)</em>{{}}177{{}}TRUE
23316{{}}370603{{}}Guardian of the Ages{{}}Magic 2014 Core Set{{}}M14{{}}Artifact Creature — Golem{{}}7{{}}7{{}}{{}}{7}{{}}7{{}}Ryan Pancoast{{}}"<em>""At my feet, invasions end.""—Statue inscription</em>"{{}}A{{}}{{}}211{{}}R{{}}2.85{{}}|||7/1/2013 : The effect of Guardian of the Ages’s triggered ability doesn’t wear off as the turn ends. Losing defender and gaining trample last indefinitely. |||7/1/2013 : Once Guardian of the Ages has lost defender, its triggered ability will no longer trigger when a creature attacks you or a planeswalker you control (unless it has somehow gained defender again).{{}}{{}}Defender <em>(This creature can't attack.)</em>|||When a creature attacks you or a planeswalker you control, if Guardian of the Ages has defender, it loses defender and gains trample.{{}}211{{}}TRUE
23317{{}}370594{{}}Haunted Plate Mail{{}}Magic 2014 Core Set{{}}M14{{}}Artifact — Equipment{{}}{{}}{{}}{{}}{4}{{}}4{{}}Izzy{{}}{{}}A{{}}{{}}212{{}}R{{}}4.193{{}}|||7/1/2013 : Although you must control no creatures to activate the “animation” ability, having a creature somehow come under your control in response to that ability won’t stop it from resolving. |||7/1/2013 : It’s possible to activate the first activated ability of Haunted Plate Mail in response to activating the first ability of another Haunted Plate Mail and have them both become creatures until end of turn. |||7/1/2013 : You can activate the equip ability of Haunted Plate Mail while it isn’t an Equipment, but the ability will have no effect. Haunted Plate Mail won’t become attached to any creature.{{}}{{}}Equipped creature gets +4/+4.|||{0}: Until end of turn, Haunted Plate Mail becomes a 4/4 Spirit artifact creature that's no longer an Equipment. Activate this ability only if you control no creatures.|||Equip {4} <em>({4}: Attach to target creature you control. Equip only as a sorcery.)</em>{{}}212{{}}TRUE
23318{{}}370817{{}}Hive Stirrings{{}}Magic 2014 Core Set{{}}M14{{}}Sorcery{{}}{{}}{{}}{{}}{2}{W}{{}}3{{}}Maciej Kuciara{{}}<em>Sliver young are sorted into clutches according to their potential and their future role. Human scholars can only guess how those are determined.</em>{{}}W{{}}{{}}21{{}}C{{}}3.088{{}}|||7/1/2013 : If you change the creature type of a Sliver you control so it’s no longer a Sliver, it will no longer be affected by its own ability. Its ability will continue to affect other Sliver creatures you control. |||7/1/2013 : Abilities that Slivers grant, as well as power/toughness boosts, are cumulative. However, for some abilities, like flying, having more than one instance of the ability doesn’t provide any additional benefit.{{}}{{}}Put two 1/1 colorless Sliver creature tokens onto the battlefield.{{}}21{{}}TRUE
23319{{}}370718{{}}Howl of the Night Pack{{}}Magic 2014 Core Set{{}}M14{{}}Sorcery{{}}{{}}{{}}{{}}{6}{G}{{}}7{{}}Lars Grant-West{{}}<em>The murderous horrors of Raven's Run are legendary, but even that haunted place goes quiet when the night wolves howl.</em>{{}}G{{}}{{}}178{{}}U{{}}3.867{{}}|||7/1/2013 : The number of Wolves you put onto the battlefield is based on the number of Forests you control when Howl of the Night Pack resolves. |||7/1/2013 : Howl of the Night Pack counts any land you control with the subtype Forest, not just ones named Forest.{{}}{{}}Put a 2/2 green Wolf creature token onto the battlefield for each Forest you control.{{}}178{{}}TRUE
